[I 2026-05-08 14:13:11,182] Trial 29 finished with value: 0.8844920073618944 and parameters: {'n_estimators': 228, 'boosting_type': 'gbdt', 'num_leaves': 130, 'max_depth': 4, 'min_child_samples': 19, 'min_child_weight': 0.019578860176024063, 'learning_rate': 0.049986265066635734, 'reg_alpha': 0.0028225833699564236, 'reg_lambda': 0.026240722564808014, 'subsample': 0.8865243379334844, 'subsample_freq': 3, 'colsample_bytree': 0.9093458926915798, 'max_cat_to_onehot': 8}. Best is trial 10 with value: 0.8936252757981137.
[OPT-007] 笘・・笘・study.optimize()蜻ｼ縺ｳ蜃ｺ縺怜ｮ御ｺ・笘・・笘・
[OPT-007] 笘・・笘・study.optimize()蜻ｼ縺ｳ蜃ｺ縺怜ｮ御ｺ・笘・・笘・
[OPT-008] 邨先棡菫晏ｭ倬幕蟋・
[OPT-009] best_score=0.8936
[OPT-010] 螻･豁ｴ菫晏ｭ伜ｮ御ｺ・ 30隧ｦ陦・

======================================================================
  譛驕ｩ蛹門ｮ御ｺ・
======================================================================
  譛濶ｯ繧ｹ繧ｳ繧｢: 0.8936
  螳御ｺ・ｩｦ陦梧焚: 30
  譫晏・繧願ｩｦ陦梧焚: 0

  譛驕ｩ繝代Λ繝｡繝ｼ繧ｿ:
    n_estimators: 255
    boosting_type: gbdt
    num_leaves: 75
    max_depth: 3
    min_child_samples: 6
    min_child_weight: 0.012003107120326536
    learning_rate: 0.08677313284480309
    reg_alpha: 0.6849678843923125
    reg_lambda: 5.3155934691365925
    subsample: 0.963511379591144
    subsample_freq: 4
    colsample_bytree: 0.9729048599868564
    max_cat_to_onehot: 9
======================================================================

[14:13:11] ( 67%) Optuna CV 5謚・窶・繝ｩ繧ｦ繝ｳ繝・0/255
[14:13:11] ( 67%) Optuna CV 5謚・窶・繝ｩ繧ｦ繝ｳ繝・20/255
[14:13:11] ( 68%) Optuna CV 5謚・窶・繝ｩ繧ｦ繝ｳ繝・40/255
[14:13:11] ( 69%) Optuna CV 5謚・窶・繝ｩ繧ｦ繝ｳ繝・60/255
[14:13:11] ( 70%) Optuna CV 5謚・窶・繝ｩ繧ｦ繝ｳ繝・80/255
[14:13:11] ( 71%) Optuna CV 5謚・窶・繝ｩ繧ｦ繝ｳ繝・100/255
[14:13:11] ( 72%) Optuna CV 5謚・窶・繝ｩ繧ｦ繝ｳ繝・120/255
[14:13:11] ( 73%) Optuna CV 5謚・窶・繝ｩ繧ｦ繝ｳ繝・140/255
[14:13:11] ( 74%) Optuna CV 5謚・窶・繝ｩ繧ｦ繝ｳ繝・160/255
[14:13:11] ( 82%) Optuna繝代Λ繝｡繝ｼ繧ｿ縺ｧ繝｢繝・Ν蜀榊ｭｦ鄙剃ｸｭ...
[14:13:11] ( 82%) Optuna譛邨ゅΔ繝・Ν 窶・繝ｩ繧ｦ繝ｳ繝・0/143
[14:13:11] ( 82%) Optuna譛邨ゅΔ繝・Ν 窶・繝ｩ繧ｦ繝ｳ繝・20/143
[14:13:11] ( 83%) Optuna譛邨ゅΔ繝・Ν 窶・繝ｩ繧ｦ繝ｳ繝・40/143
[14:13:11] ( 84%) Optuna譛邨ゅΔ繝・Ν 窶・繝ｩ繧ｦ繝ｳ繝・60/143
[14:13:11] ( 84%) Optuna譛邨ゅΔ繝・Ν 窶・繝ｩ繧ｦ繝ｳ繝・80/143
[14:13:11] ( 85%) Optuna譛邨ゅΔ繝・Ν 窶・繝ｩ繧ｦ繝ｳ繝・100/143
[14:13:11] ( 86%) Optuna譛邨ゅΔ繝・Ν 窶・繝ｩ繧ｦ繝ｳ繝・120/143
[14:13:11] ( 86%) Optuna譛邨ゅΔ繝・Ν 窶・繝ｩ繧ｦ繝ｳ繝・140/143
[14:13:11] ( 88%) 遒ｺ邇・く繝｣繝ｪ繝悶Ξ繝ｼ繧ｷ繝ｧ繝ｳ荳ｭ...
2026-05-08 14:13:11,797 - INFO - BetaCalibration 繧剃ｽｿ逕ｨ縺励※繧ｭ繝｣繝ｪ繝悶Ξ繝ｼ繧ｷ繝ｧ繝ｳ蟄ｦ鄙貞
ｮ御ｺ・
[14:13:11] ( 93%) 繝｢繝・Ν繧剃ｿ晏ｭ倅ｸｭ...
2026-05-08 14:13:11,943 - INFO - feature_catalog.yaml 縺ｫ 18 莉ｶ縺ｮ譁ｰ隕冗音蠕ｴ驥上ｒ霑ｽ險・ 
['sf_index_last', 'sf_index_2ago', 'sf_index_3ago', 'sf_max_index', 'sf_course_
max_index', 'sf_dist_max_index', 'sf_index_trend', 'training_comment_score', 's
ire_venue_win_rate', 'damsire_venue_win_rate', 'training_comment_score_is_missi
ng', 'sf_index_last_is_missing', 'sf_index_2ago_is_missing', 'sf_index_3ago_is_
missing', 'sf_max_index_is_missing', 'sf_course_max_index_is_missing', 'sf_dist
_max_index_is_missing', 'sf_index_trend_is_missing']
[14:13:11] ( 98%) 蟄ｦ鄙貞ｮ御ｺ・
[14:13:11]   蟄ｦ鄙貞ｮ御ｺ・
[14:13:11]     model_id     : 20250105_20260201_20260508_1413
[14:13:11]     data_count   : 4622
[14:13:11]     race_count   : 379
[14:13:11]     feature_count: 145
[14:13:11]     AUC          : 0.8655801435406699
[14:13:11]     CV AUC       : 0.8881006779523404
[14:13:11]     LogLoss      : 0.21658171032252607
[14:13:11] ============================================================
[14:13:11] STEP B: 蟄ｦ鄙・ target=speed_deviation  2025-01 縲・2026-03
[14:13:11] ============================================================

======================================================================
縲仙ｭｦ鄙偵Μ繧ｯ繧ｨ繧ｹ繝亥女菫｡縲・
======================================================================
  target: speed_deviation
  model_type: lightgbm
  use_optimizer: True
  use_optuna: True
  optuna_trials: 30
  cv_folds: 5
======================================================================

[14:13:11] (  3%) 繝・・繧ｿ繝吶・繧ｹ謗･邯壻ｸｭ...
[14:13:11] (  8%) 蟄ｦ鄙偵ョ繝ｼ繧ｿ隱ｭ縺ｿ霎ｼ縺ｿ荳ｭ...
2026-05-08 14:13:12,964 - INFO - training_data 隱ｭ縺ｿ霎ｼ縺ｿ: 2124 陦・
2026-05-08 14:13:12,971 - INFO - speed_figures 隱ｭ縺ｿ霎ｼ縺ｿ: 2948 陦・
竊・Ultimate DB縺九ｉ繝・・繧ｿ隱ｭ縺ｿ霎ｼ縺ｿ: C:\Users\yuki2\Documents\ws\keiba-ai-pro\keiba\data\keiba_ultimate.db
  邨ｶ蟇ｾ繝代せ: C:\Users\yuki2\Documents\ws\keiba-ai-pro\keiba\data\keiba_ultimate.db
  蟄伜惠繝√ぉ繝・け: True
  笞 _invalid_distance 繝ｬ繝ｼ繧ｹ繧偵せ繧ｭ繝・・: 49 繝ｬ繝ｼ繧ｹ
    (tools/fix_distance_zero.py 繧貞ｮ溯｡後☆繧九→菫ｮ豁｣繝ｻ蜀咲匳骭ｲ縺ｧ縺阪∪縺・
  笨・return_tables_ultimate: 2922繝ｬ繝ｼ繧ｹ縺ｮ驟榊ｽ捺ュ蝣ｱ繧偵Ο繝ｼ繝・
  笨・27290陦悟叙蠕・
  笞 _invalid_distance 繧ｨ繝ｳ繝医Μ繧偵せ繧ｭ繝・・: 74 莉ｶ
  笨・DataFrame螟画鋤: 27216陦・ﾃ・118蛻・
  笨・num_horses: 谺謳阪↑縺・(27216莉ｶ)
  笨・venue 繧ｳ繝ｼ繝芽ｧ｣豎ｺ: 26792莉ｶ
  笨・蝙句､画鋤螳御ｺ・ 謨ｰ蛟､=72蛻・ 譁・ｭ怜・=55蛻・ 蜷郁ｨ・127蛻・
  笨・distance: 27216莉ｶ蜿門ｾ・
  笨・surface: 27216莉ｶ蜿門ｾ・
DEBUG: Loaded 27216 rows from database
[14:13:12] ( 15%) 繝・・繧ｿ隱ｭ縺ｿ霎ｼ縺ｿ螳御ｺ・(27,216 陦・
[14:13:12] ( 20%) 迚ｹ蠕ｴ驥上お繝ｳ繧ｸ繝九い繝ｪ繝ｳ繧ｰ荳ｭ...

=== LightGBM譛驕ｩ蛹悶Δ繝ｼ繝・===
[14:13:29] ( 28%) 迚ｹ蠕ｴ驥城∈謚槭・譛驕ｩ蛹紋ｸｭ...
2026-05-08 14:13:30,868 - INFO - P-4: 螳御ｺ・紫50%譛ｪ貅縺ｮ繝ｬ繝ｼ繧ｹ 110莉ｶ (1531陦・ 繧帝勁蜴ｻ
2026-05-08 14:13:31,005 - INFO - speed_deviation 蜑榊・逅・ finish_time NaN 237 陦後ｒ髯
､蜴ｻ (25448 陦後′譛牙柑)
2026-05-08 14:13:31,114 - INFO - 譎らｳｻ蛻怜・蜑ｲ: 蟄ｦ鄙・20682陦・ 繝・せ繝・4766陦・
  笞 [fix-A][隕∬ｪｿ譟ｻ] distance=0/NaN 縺梧ｮ句ｭ・ 7 莉ｶ 竊・荳ｭ螟ｮ蛟､ 1400m 縺ｧ邱頑･陬懷ｮ鯉ｼ域悽譚･縺ｯ繧ｹ繧ｭ繝・・蟇ｾ雎｡・・
     tools/fix_distance_zero.py --dry-run 縺ｧ蜴溷屏繧堤｢ｺ隱阪＠縺ｦ縺上□縺輔＞

================================================================================
縲伸ightGBM迚ｹ蠕ｴ驥乗怙驕ｩ蛹悶大ｭｦ鄙偵Δ繝ｼ繝・
================================================================================

縲・. 菴弱き繝ｼ繝・ぅ繝翫Μ繝・ぅ 繧ｫ繝・ざ繝ｪ繧ｫ繝ｫ螟画焚縲・
蜃ｦ逅・ Label Encoding 竊・LightGBM縺ｮcategorical_feature謖・ｮ・
  笨・venue                          竊・venue_encoded                  (23遞ｮ鬘・
  笨・venue_code                     竊・venue_code_encoded             (14遞ｮ鬘・
  笨・track_type                     竊・track_type_encoded             (3遞ｮ鬘・
  笨・surface                        竊・surface_encoded                (5遞ｮ鬘・
  笨・weather                        竊・weather_encoded                (6遞ｮ鬘・
  笨・field_condition                竊・field_condition_encoded        (6遞ｮ鬘・
  笨・race_class                     竊・race_class_encoded             (28遞ｮ鬘・
  笨・course_direction               竊・course_direction_encoded       (4遞ｮ鬘・
  笨・sex                            竊・sex_encoded                    (3遞ｮ鬘・
  笨・corner_radius                  竊・corner_radius_encoded          (2遞ｮ鬘・

  蜈・・繧ｫ繝・ざ繝ｪ繧ｫ繝ｫ繧ｫ繝ｩ繝繧貞炎髯､: ['venue', 'venue_code', 'track_type', 'surface', 'weather', 'field_condition', 'race_class', 'course_direction', 'sex', 'corner_radius']

縲・. 鬮倥き繝ｼ繝・ぅ繝翫Μ繝・ぅ譁・ｭ怜・蛻励・
蜃ｦ逅・ 蜑企勁・育ｵｱ險育音蠕ｴ驥上・ feature_engineering.py 縺ｧ險育ｮ玲ｸ医∩・・
  笨・jockey_name 竊・蜑企勁
  笨・trainer_name 竊・蜑企勁
  笨・horse_name 竊・蜑企勁
  笨・sire 竊・蜑企勁
  笨・dam 竊・蜑企勁
  笨・damsire 竊・蜑企勁

縲・. 謨ｰ蛟､螟画焚縲・
蜃ｦ逅・ 縺昴・縺ｾ縺ｾ菴ｿ逕ｨ・・ightGBM縺ｯ閾ｪ蜍輔〒繧ｹ繧ｱ繝ｼ繝ｪ繝ｳ繧ｰ荳崎ｦ・ｼ・
  笨・謨ｰ蛟､迚ｹ蠕ｴ驥・ 126蛟・
    - horse_number
    - bracket_number
    - horse_weight
    - horse_weight_change
    - weight_change
    - age
    - odds
    - popularity
    - distance
    - num_horses
    ... 莉・16蛟・

縲・. 繝舌う繝翫Μ迚ｹ蠕ｴ驥上・
蜃ｦ逅・ 縺昴・縺ｾ縺ｾ菴ｿ逕ｨ・・/1繧ｨ繝ｳ繧ｳ繝ｼ繝画ｸ医∩・・
  笨・繝舌う繝翫Μ迚ｹ蠕ｴ驥・ 5蛟・

縲・. 繝ｪ繧ｹ繝亥梛螟画焚縲・
蜃ｦ逅・ 邨ｱ險亥､・亥ｹｳ蝮・∝・謨｣縺ｪ縺ｩ・峨↓螟画鋤

縲・. 繝繝溘・螟画焚縲・
蜃ｦ逅・ 縺昴・縺ｾ縺ｾ菴ｿ逕ｨ・域里縺ｫ繝舌う繝翫Μ蛹匁ｸ医∩・・
  笨・諤ｧ蛻･繝繝溘・: ['sex_age', 'sex_繧ｻ', 'sex_迚・, 'sex_迚｡', 'sex_code', 'sex_encoded']
  笨・繝壹・繧ｹ繝繝溘・: ['pace_advantage']
  笨・莨鷹､頑悄髢薙ム繝溘・: ['rest_category', 'rest_short', 'rest_normal', 'rest_long', 'rest_very_long']

縲・. ID邉ｻ螟画焚縲・
蜃ｦ逅・ 縺昴・縺ｾ縺ｾ菫晄戟・育ｵｱ險郁ｨ育ｮ励↓菴ｿ逕ｨ縲∝ｭｦ鄙呈凾縺ｯ髯､螟匁耳螂ｨ・・
  笨・ID迚ｹ蠕ｴ驥・ ['race_id', 'horse_id', 'jockey_id', 'trainer_id']
    竊・蟄ｦ鄙呈凾縺ｫ縺ｯ縺薙ｌ繧峨ｒ髯､螟悶＠縺ｦ縺上□縺輔＞

縲・. 譌･譎ょ､画焚縲・
蜃ｦ逅・ 謨ｰ蛟､蛹厄ｼ亥ｹｴ/譛・譌･/譖懈律縺ｪ縺ｩ・・
  笨・date 竊・date_year, date_month, date_day, date_dayofweek

縲・. 荳崎ｦ√↑螟画焚・亥炎髯､謗ｨ螂ｨ・峨・
  笨・post_time 竊・蜑企勁
  笨・horse_url 竊・蜑企勁
  笨・jockey_url 竊・蜑企勁
  笨・trainer_url 竊・蜑企勁
  笨・time 竊・蜑企勁
  笨・horse_owner 竊・蜑企勁
  笨・horse_breeder 竊・蜑企勁
  笨・horse_breeding_farm 竊・蜑企勁
  笨・horse_birth_date 竊・蜑企勁
  笨・surface_ja 竊・蜑企勁
  笨・surface_en 竊・蜑企勁
  笨・sex_age 竊・蜑企勁
  笨・race_date 竊・蜑企勁
  笨・weight 竊・蜑企勁
  笨・prev_race_venue 竊・蜑企勁
  笨・prev2_race_venue 竊・蜑企勁
  笨・prev3_race_venue 竊・蜑企勁
  笨・prev4_race_venue 竊・蜑企勁
  笨・prev5_race_venue 竊・蜑企勁
  笨・prev_race_date 竊・蜑企勁
  笨・prev2_race_date 竊・蜑企勁
  笨・prev3_race_date 竊・蜑企勁
  笨・prev4_race_date 竊・蜑企勁
  笨・prev5_race_date 竊・蜑企勁
  笨・race_name 竊・蜑企勁
  笨・horse_distance_win_rate 竊・蜑企勁
  笨・horse_distance_avg_finish 竊・蜑企勁
  笨・distance_increased 竊・蜑企勁
  笨・distance_decreased 竊・蜑企勁
  笨・weight_kg 竊・蜑企勁
  笨・weight_change 竊・蜑企勁
  笨・jockey_weight 竊・蜑企勁
  笨・n_horses 竊・蜑企勁
  笨・prev_race_time 竊・蜑企勁
  笨・tansho_payout 竊・蜑企勁
  笨・sanrentan_payout 竊・蜑企勁
  笨・fukusho_min_payout 竊・蜑企勁
  笨・fukusho_max_payout 竊・蜑企勁
  笨・tansho_payout_log 竊・蜑企勁
  笨・sanrentan_payout_log 竊・蜑企勁
  笨・sanrentan_z_in_races 竊・蜑企勁
  笨・tansho_implied_prob 竊・蜑企勁
  笨・tansho_payout_is_missing 竊・蜑企勁
  笨・sanrentan_payout_is_missing 竊・蜑企勁
  笨・is_surface_change 竊・蜑企勁
  笨・implied_prob_norm 竊・蜑企勁
  笨・odds_rank_in_race 竊・蜑企勁
  笨・horse_win_rate 竊・蜑企勁
  笨・horse_win_rate_is_missing 竊・蜑企勁
  笨・horse_total_wins 竊・蜑企勁
  笨・horse_total_runs 竊・蜑企勁
  笨・horse_total_prize_money 竊・蜑企勁
  笨・popularity_is_missing 竊・蜑企勁
  笨・odds_is_missing 竊・蜑企勁
  笨・prev_race_finish_is_missing 竊・蜑企勁
  笨・prev2_race_finish_is_missing 竊・蜑企勁
  笨・prev_race_distance_is_missing 竊・蜑企勁
  笨・prev2_race_distance_is_missing 竊・蜑企勁
  笨・prev_race_time_is_missing 竊・蜑企勁
  笨・prev_speed_index_is_missing 竊・蜑企勁
  笨・prev_speed_zscore_is_missing 竊・蜑企勁
  笨・race_class_num_is_missing 竊・蜑企勁
  笨・days_since_last_race_is_missing 竊・蜑企勁
  笨・is_young 竊・蜑企勁
  笨・is_prime 竊・蜑企勁
  笨・is_veteran 竊・蜑企勁
  笨・inner_advantage 竊・蜑企勁
  笨・inner_bias 竊・蜑企勁
  笨・rest_category 竊・蜑企勁
  笨・rest_short 竊・蜑企勁
  笨・rest_normal 竊・蜑企勁
  笨・rest_long 竊・蜑企勁
  笨・rest_very_long 竊・蜑企勁
  笨・season 竊・蜑企勁
  笨・age 竊・蜑企勁
  笨・prev2_speed_zscore_is_missing 竊・蜑企勁
  笨・prev_race_weight 竊・蜑企勁
  笨・prev2_race_weight 竊・蜑企勁
  笨・burden_weight 竊・蜑企勁
  笨・prev_race_time_seconds 竊・蜑企勁
  笨・prev2_race_time 竊・蜑企勁
  笨・bracket_number 竊・蜑企勁
  笨・straight_length 竊・蜑企勁
  笨・horse_surface_win_rate 竊・蜑企勁
  笨・horse_surface_races 竊・蜑企勁
  笨・horse_dist_band_win_rate 竊・蜑企勁
  笨・horse_dist_band_races 竊・蜑企勁
  笨・horse_venue_win_rate 竊・蜑企勁
  笨・horse_venue_races 竊・蜑企勁
  笨・horse_distance_races 竊・蜑企勁
  笨・horse_venue_surface_win_rate 竊・蜑企勁
  笨・horse_venue_surface_races 竊・蜑企勁
  笨・horse_dist_surface_win_rate 竊・蜑企勁
  笨・horse_dist_surface_races 竊・蜑企勁
  笨・past5_avg_finish 竊・蜑企勁
  笨・past10_avg_finish 竊・蜑企勁
  笨・past3_win_rate 竊・蜑企勁
  笨・past5_win_rate 竊・蜑企勁
  笨・past3_avg_last3f_rank 竊・蜑企勁
  笨・past5_avg_last3f_time 竊・蜑企勁
  笨・past3_avg_last3f_time 竊・蜑企勁
  笨・is_first_race 竊・蜑企勁
  笨・fe_trainer_win_rate 竊・蜑企勁
  笨・jt_combo_win_rate 竊・蜑企勁
  笨・trainer_place_rate_top2 竊・蜑企勁
  笨・jockey_place_rate_top2 竊・蜑企勁
  笨・surface_encoded 竊・蜑企勁
  笨・track_type_encoded 竊・蜑企勁
  笨・course_direction_encoded 竊・蜑企勁
  笨・corner_radius_encoded 竊・蜑企勁
  笨・prev2_speed_index_is_missing 竊・蜑企勁
  笨・jt_combo_races 竊・蜑企勁
  笨・race_class_num 竊・蜑企勁
  笨・odds_z_in_race 竊・蜑企勁
  笨・popularity_normalized 竊・蜑企勁
  笨・top3_probability 竊・蜑企勁
  笨・implied_prob 竊・蜑企勁
  笨・popularity 竊・蜑企勁
  笨・prev2_speed_index 竊・蜑企勁
  笨・prev2_speed_zscore 竊・蜑企勁
  笨・jockey_show_rate 竊・蜑企勁
  笨・trainer_show_rate 竊・蜑企勁
  笨・諤ｧ蛻･繝繝溘・・磯㍾隍・ｼ牙炎髯､: ['sex_繧ｻ', 'sex_迚・, 'sex_迚｡', 'sex_code']

  笞・・ 谺謳咲紫90%雜・・蛻励ｒ髯､蜴ｻ (34蛻・: ['weight_diff', '_shutuba', 'lap_200m', 'lap_400m', 'lap_600m', 'lap_800m', 'lap_1000m', 'lap_1200m']...
  笞・・ [fix-D] 繧ｼ繝ｭ蛻・淵蛻励ｒ髯､蜴ｻ (18蛻・: ['horse_speed_rank_pct_is_missing', 'sire_surface_win_rate_is_missing', 'sire_dist_band_win_rate_is_missing', 'damsire_surface_win_rate_is_missing', 'damsire_dist_band_win_rate_is_missing', 'running_style_std_5_is_missing', 'horse_field_win_rate_is_missing', 'horse_field_races_is_missing', 'horse_weather_win_rate_is_missing', 'horse_weather_races_is_missing', 'jockey_field_win_rate_is_missing', 'jockey_field_races_is_missing', 'sire_field_win_rate_is_missing', 'sire_field_races_is_missing', 'damsire_field_win_rate_is_missing', 'damsire_field_races_is_missing', 'kai_num_is_missing', 'day_num_is_missing']

================================================================================
縲先怙驕ｩ蛹門ｮ御ｺ・・
================================================================================
  蜈・・繧ｫ繝ｩ繝謨ｰ: 160蛟・
  繧ｫ繝・ざ繝ｪ繧ｫ繝ｫ迚ｹ蠕ｴ驥・ 10蛟・
    竊・LightGBM縺ｮcategorical_feature蠑墓焚縺ｫ謖・ｮ・ ['venue_encoded', 'venue_code_encoded', 'track_type_encoded', 'surface_encoded', 'weather_encoded']...

  謗ｨ螂ｨLightGBM繝代Λ繝｡繝ｼ繧ｿ:
    'categorical_feature': ['venue_encoded', 'venue_code_encoded', 'track_type_encoded', 'surface_encoded', 'weather_encoded', 'field_condition_encoded', 'race_class_encoded', 'course_direction_encoded', 'sex_encoded', 'corner_radius_encoded']
    'max_cat_to_onehot': 4  # 4遞ｮ鬘樔ｻ･荳九・閾ｪ蜍輔〒繝ｯ繝ｳ繝帙ャ繝亥喧
================================================================================

[14:13:31] ( 35%) CV蟄ｦ鄙剃ｸｭ (5謚・...
[14:13:31] ( 35%) CV 5謚・窶・繝ｩ繧ｦ繝ｳ繝・0/1000
[14:13:31] ( 35%) CV 5謚・窶・繝ｩ繧ｦ繝ｳ繝・20/1000
[14:13:31] ( 35%) CV 5謚・窶・繝ｩ繧ｦ繝ｳ繝・40/1000
[14:13:32] ( 36%) CV 5謚・窶・繝ｩ繧ｦ繝ｳ繝・60/1000
[14:13:32] ( 36%) CV 5謚・窶・繝ｩ繧ｦ繝ｳ繝・80/1000
[14:13:32] ( 37%) CV 5謚・窶・繝ｩ繧ｦ繝ｳ繝・100/1000
[14:13:32] ( 37%) CV 5謚・窶・繝ｩ繧ｦ繝ｳ繝・120/1000
[14:13:33] ( 38%) CV 5謚・窶・繝ｩ繧ｦ繝ｳ繝・140/1000
[14:13:33] ( 38%) CV 5謚・窶・繝ｩ繧ｦ繝ｳ繝・160/1000
[14:13:33] ( 38%) CV 5謚・窶・繝ｩ繧ｦ繝ｳ繝・180/1000
[14:13:33] ( 39%) CV 5謚・窶・繝ｩ繧ｦ繝ｳ繝・200/1000
[14:13:34] ( 39%) CV 5謚・窶・繝ｩ繧ｦ繝ｳ繝・220/1000
[14:13:34] ( 40%) CV 5謚・窶・繝ｩ繧ｦ繝ｳ繝・240/1000
[14:13:34] ( 40%) CV 5謚・窶・繝ｩ繧ｦ繝ｳ繝・260/1000
[14:13:34] ( 41%) CV 5謚・窶・繝ｩ繧ｦ繝ｳ繝・280/1000
[14:13:34] ( 41%) CV 5謚・窶・繝ｩ繧ｦ繝ｳ繝・300/1000
[14:13:35] ( 42%) CV 5謚・窶・繝ｩ繧ｦ繝ｳ繝・320/1000
[14:13:35] ( 42%) CV 5謚・窶・繝ｩ繧ｦ繝ｳ繝・340/1000
[14:13:35] ( 42%) CV 5謚・窶・繝ｩ繧ｦ繝ｳ繝・360/1000
[14:13:35] ( 43%) CV 5謚・窶・繝ｩ繧ｦ繝ｳ繝・380/1000
[14:13:36] ( 43%) CV 5謚・窶・繝ｩ繧ｦ繝ｳ繝・400/1000
[14:13:36] ( 44%) CV 5謚・窶・繝ｩ繧ｦ繝ｳ繝・420/1000
[14:13:36] ( 44%) CV 5謚・窶・繝ｩ繧ｦ繝ｳ繝・440/1000
[14:13:36] ( 45%) CV 5謚・窶・繝ｩ繧ｦ繝ｳ繝・460/1000
[14:13:36] ( 45%) CV 5謚・窶・繝ｩ繧ｦ繝ｳ繝・480/1000
[14:13:37] ( 46%) CV 5謚・窶・繝ｩ繧ｦ繝ｳ繝・500/1000
[14:13:37] ( 60%) 譛邨ゅΔ繝・Ν蟄ｦ鄙剃ｸｭ...
[14:13:37] ( 60%) 譛邨ゅΔ繝・Ν 窶・繝ｩ繧ｦ繝ｳ繝・0/567
[14:13:37] ( 60%) 譛邨ゅΔ繝・Ν 窶・繝ｩ繧ｦ繝ｳ繝・20/567
[14:13:37] ( 60%) 譛邨ゅΔ繝・Ν 窶・繝ｩ繧ｦ繝ｳ繝・40/567
[14:13:37] ( 60%) 譛邨ゅΔ繝・Ν 窶・繝ｩ繧ｦ繝ｳ繝・60/567
[14:13:37] ( 60%) 譛邨ゅΔ繝・Ν 窶・繝ｩ繧ｦ繝ｳ繝・80/567
[14:13:37] ( 60%) 譛邨ゅΔ繝・Ν 窶・繝ｩ繧ｦ繝ｳ繝・100/567
[14:13:37] ( 61%) 譛邨ゅΔ繝・Ν 窶・繝ｩ繧ｦ繝ｳ繝・120/567
[14:13:37] ( 61%) 譛邨ゅΔ繝・Ν 窶・繝ｩ繧ｦ繝ｳ繝・140/567
[14:13:37] ( 61%) 譛邨ゅΔ繝・Ν 窶・繝ｩ繧ｦ繝ｳ繝・160/567
[14:13:37] ( 61%) 譛邨ゅΔ繝・Ν 窶・繝ｩ繧ｦ繝ｳ繝・180/567
[14:13:37] ( 61%) 譛邨ゅΔ繝・Ν 窶・繝ｩ繧ｦ繝ｳ繝・200/567
[14:13:37] ( 61%) 譛邨ゅΔ繝・Ν 窶・繝ｩ繧ｦ繝ｳ繝・220/567
[14:13:37] ( 62%) 譛邨ゅΔ繝・Ν 窶・繝ｩ繧ｦ繝ｳ繝・240/567
[14:13:37] ( 62%) 譛邨ゅΔ繝・Ν 窶・繝ｩ繧ｦ繝ｳ繝・260/567
[14:13:37] ( 62%) 譛邨ゅΔ繝・Ν 窶・繝ｩ繧ｦ繝ｳ繝・280/567
[14:13:37] ( 62%) 譛邨ゅΔ繝・Ν 窶・繝ｩ繧ｦ繝ｳ繝・300/567
[14:13:37] ( 62%) 譛邨ゅΔ繝・Ν 窶・繝ｩ繧ｦ繝ｳ繝・320/567
[14:13:37] ( 62%) 譛邨ゅΔ繝・Ν 窶・繝ｩ繧ｦ繝ｳ繝・340/567
[14:13:38] ( 63%) 譛邨ゅΔ繝・Ν 窶・繝ｩ繧ｦ繝ｳ繝・360/567
[14:13:38] ( 63%) 譛邨ゅΔ繝・Ν 窶・繝ｩ繧ｦ繝ｳ繝・380/567
[14:13:38] ( 63%) 譛邨ゅΔ繝・Ν 窶・繝ｩ繧ｦ繝ｳ繝・400/567
[14:13:38] ( 63%) 譛邨ゅΔ繝・Ν 窶・繝ｩ繧ｦ繝ｳ繝・420/567
[14:13:38] ( 63%) 譛邨ゅΔ繝・Ν 窶・繝ｩ繧ｦ繝ｳ繝・440/567
[14:13:38] ( 64%) 譛邨ゅΔ繝・Ν 窶・繝ｩ繧ｦ繝ｳ繝・460/567
[14:13:38] ( 64%) 譛邨ゅΔ繝・Ν 窶・繝ｩ繧ｦ繝ｳ繝・480/567
[14:13:38] ( 64%) 譛邨ゅΔ繝・Ν 窶・繝ｩ繧ｦ繝ｳ繝・500/567
[14:13:38] ( 64%) 譛邨ゅΔ繝・Ν 窶・繝ｩ繧ｦ繝ｳ繝・520/567
[14:13:38] ( 64%) 譛邨ゅΔ繝・Ν 窶・繝ｩ繧ｦ繝ｳ繝・540/567
[14:13:38] ( 64%) 譛邨ゅΔ繝・Ν 窶・繝ｩ繧ｦ繝ｳ繝・560/567
2026-05-08 14:13:38,889 - INFO - [貂ｩ蠎ｦ繧ｭ繝｣繝ｪ繝悶Ξ繝ｼ繧ｷ繝ｧ繝ｳ] 譛驕ｩ T = 0.2372
2026-05-08 14:13:38,922 - INFO - [隧穂ｾ｡謖・ｨ兢 Spearman_ﾏ・0.7073, RMSE=0.7591, Top-
1=0.6035, T=0.2372

=== Optuna繝上う繝代・繝代Λ繝｡繝ｼ繧ｿ譛驕ｩ蛹・===
[14:13:38] ( 65%) Optuna譛驕ｩ蛹紋ｸｭ (30隧ｦ陦・...
[I 2026-05-08 14:13:39,048] A new study created in memory with name: lightgbm_o
ptimization

[OPT-001] optimize()繝｡繧ｽ繝・ラ髢句ｧ・
[OPT-002] X.shape=(25448, 152), y.shape=(25448,)
[OPT-003] n_trials=30, cv_folds=5

======================================================================
  Optuna 繝上う繝代・繝代Λ繝｡繝ｼ繧ｿ譛驕ｩ蛹夜幕蟋・
======================================================================
  隧ｦ陦悟屓謨ｰ: 30
  CV繝輔か繝ｼ繝ｫ繝・ 5
  繝・・繧ｿ謨ｰ: 25448陦・ﾃ・152蛻・
  繧ｫ繝・ざ繝ｪ繧ｫ繝ｫ迚ｹ蠕ｴ驥・ 6蛟・
  繧ｿ繧､繝繧｢繧ｦ繝・ 300遘・
======================================================================

[OPT-004] 繧ｹ繧ｿ繝・ぅ菴懈・髢句ｧ・
[OPT-005] 繧ｹ繧ｿ繝・ぅ菴懈・螳御ｺ・
[OPT-006] 笘・・笘・study.optimize()蜻ｼ縺ｳ蜃ｺ縺礼峩蜑・笘・・笘・

  0%|          | 0/30 [00:00<?, ?it/s]
                                      

  0%|          | 0/30 [00:01<?, ?it/s]
Best trial: 0. Best value: -0.671263:   0%|          | 0/30 [00:01<?, ?it/s]
Best trial: 0. Best value: -0.671263:   3%|笆・        | 1/30 [00:01<00:48,  1.68
s/it]
Best trial: 0. Best value: -0.671263:   3%|笆・        | 1/30 [00:01<00:48,  1.68
s/it, 1.67/300 seconds]
                                                                               
                       

Best trial: 0. Best value: -0.671263:   3%|笆・        | 1/30 [00:08<00:48,  1.68
s/it, 1.67/300 seconds]
Best trial: 1. Best value: -0.950098:   3%|笆・        | 1/30 [00:08<00:48,  1.68
s/it, 1.67/300 seconds]
Best trial: 1. Best value: -0.950098:   7%|笆・        | 2/30 [00:08<02:10,  4.67
s/it, 1.67/300 seconds]
Best trial: 1. Best value: -0.950098:   7%|笆・        | 2/30 [00:08<02:10,  4.67
s/it, 8.45/300 seconds]
                                                                               
                       

Best trial: 1. Best value: -0.950098:   7%|笆・        | 2/30 [00:15<02:10,  4.67
s/it, 8.45/300 seconds]
Best trial: 1. Best value: -0.950098:   7%|笆・        | 2/30 [00:15<02:10,  4.67
s/it, 8.45/300 seconds]
Best trial: 1. Best value: -0.950098:  10%|笆・        | 3/30 [00:15<02:41,  5.97
s/it, 8.45/300 seconds]
Best trial: 1. Best value: -0.950098:  10%|笆・        | 3/30 [00:15<02:41,  5.97
s/it, 15.97/300 seconds]
                                                                               
                        

Best trial: 1. Best value: -0.950098:  10%|笆・        | 3/30 [00:19<02:41,  5.97
s/it, 15.97/300 seconds]
Best trial: 1. Best value: -0.950098:  10%|笆・        | 3/30 [00:19<02:41,  5.97
s/it, 15.97/300 seconds]
Best trial: 1. Best value: -0.950098:  13%|笆遺鮪        | 4/30 [00:19<02:14,  5.1
9s/it, 15.97/300 seconds]
Best trial: 1. Best value: -0.950098:  13%|笆遺鮪        | 4/30 [00:19<02:14,  5.1
9s/it, 19.95/300 seconds]
                                                                               
                        

Best trial: 1. Best value: -0.950098:  13%|笆遺鮪        | 4/30 [00:22<02:14,  5.1
9s/it, 19.95/300 seconds]
Best trial: 1. Best value: -0.950098:  13%|笆遺鮪        | 4/30 [00:22<02:14,  5.1
9s/it, 19.95/300 seconds]
Best trial: 1. Best value: -0.950098:  17%|笆遺幕        | 5/30 [00:22<01:41,  4.0
7s/it, 19.95/300 seconds]
Best trial: 1. Best value: -0.950098:  17%|笆遺幕        | 5/30 [00:22<01:41,  4.0
7s/it, 22.05/300 seconds]
                                                                               
                        

Best trial: 1. Best value: -0.950098:  17%|笆遺幕        | 5/30 [00:40<01:41,  4.0
7s/it, 22.05/300 seconds]
Best trial: 1. Best value: -0.950098:  17%|笆遺幕        | 5/30 [00:40<01:41,  4.0
7s/it, 22.05/300 seconds]
Best trial: 1. Best value: -0.950098:  20%|笆遺毎        | 6/30 [00:40<03:33,  8.9
1s/it, 22.05/300 seconds]
Best trial: 1. Best value: -0.950098:  20%|笆遺毎        | 6/30 [00:40<03:33,  8.9
1s/it, 40.34/300 seconds]
                                                                               
                        

Best trial: 1. Best value: -0.950098:  20%|笆遺毎        | 6/30 [00:46<03:33,  8.9
1s/it, 40.34/300 seconds]
Best trial: 1. Best value: -0.950098:  20%|笆遺毎        | 6/30 [00:46<03:33,  8.9
1s/it, 40.34/300 seconds]
Best trial: 1. Best value: -0.950098:  23%|笆遺毎笆・      | 7/30 [00:46<03:03,  7.9
8s/it, 40.34/300 seconds]
Best trial: 1. Best value: -0.950098:  23%|笆遺毎笆・      | 7/30 [00:46<03:03,  7.9
8s/it, 46.40/300 seconds]
                                                                               
                        

Best trial: 1. Best value: -0.950098:  23%|笆遺毎笆・      | 7/30 [00:49<03:03,  7.9
8s/it, 46.40/300 seconds]
Best trial: 1. Best value: -0.950098:  23%|笆遺毎笆・      | 7/30 [00:49<03:03,  7.9
8s/it, 46.40/300 seconds]
Best trial: 1. Best value: -0.950098:  27%|笆遺毎笆・      | 8/30 [00:49<02:19,  6.3
2s/it, 46.40/300 seconds]
Best trial: 1. Best value: -0.950098:  27%|笆遺毎笆・      | 8/30 [00:49<02:19,  6.3
2s/it, 49.17/300 seconds]
                                                                               
                        

Best trial: 1. Best value: -0.950098:  27%|笆遺毎笆・      | 8/30 [00:52<02:19,  6.3
2s/it, 49.17/300 seconds]
Best trial: 1. Best value: -0.950098:  27%|笆遺毎笆・      | 8/30 [00:52<02:19,  6.3
2s/it, 49.17/300 seconds]
Best trial: 1. Best value: -0.950098:  30%|笆遺毎笆・      | 9/30 [00:52<01:53,  5.4
0s/it, 49.17/300 seconds]
Best trial: 1. Best value: -0.950098:  30%|笆遺毎笆・      | 9/30 [00:52<01:53,  5.4
0s/it, 52.54/300 seconds]
                                                                               
                        

Best trial: 1. Best value: -0.950098:  30%|笆遺毎笆・      | 9/30 [01:03<01:53,  5.4
0s/it, 52.54/300 seconds]
Best trial: 1. Best value: -0.950098:  30%|笆遺毎笆・      | 9/30 [01:03<01:53,  5.4
0s/it, 52.54/300 seconds]
Best trial: 1. Best value: -0.950098:  33%|笆遺毎笆遺鮪      | 10/30 [01:03<02:19,  7
.00s/it, 52.54/300 seconds]
Best trial: 1. Best value: -0.950098:  33%|笆遺毎笆遺鮪      | 10/30 [01:03<02:19,  7
.00s/it, 63.12/300 seconds]
                                                                               
                         

Best trial: 1. Best value: -0.950098:  33%|笆遺毎笆遺鮪      | 10/30 [01:10<02:19,  7
.00s/it, 63.12/300 seconds]
Best