[14:12:21] ============================================================
[14:12:21] 1蟷ｴ髢楢ｩ穂ｾ｡繝代う繝励Λ繧､繝ｳ・育峩謗･蜻ｼ縺ｳ蜃ｺ縺礼沿・蛾幕蟋・
[14:12:21]   蟇ｾ雎｡譛滄俣  : 20250101 縲・20260331
[14:12:21]   繧ｿ繝ｼ繧ｲ繝・ヨ: win,speed_deviation
[14:12:21]   Optuna 隧ｦ陦梧焚: 30
[14:12:21] ============================================================
[14:12:21] 
--- DB 迴ｾ迥ｶ遒ｺ隱・---
[14:12:21]   DB 邱剰｡梧焚: 27,290
[14:12:21]   scraped_dates (2025-01縲・026-03): 8 譌･
[14:12:21]   譛蜿､: 20250105  譛譁ｰ: 20250504
[14:12:21] 
(繧ｹ繧ｯ繝ｬ繧､繝励せ繧ｭ繝・・)
[14:12:21] ============================================================
[14:12:21] STEP B: 蟄ｦ鄙・ target=win  2025-01 縲・2026-03
[14:12:21] ============================================================
python-api\.venv\Scripts\python.exe : 2026-05-08 14:12:23,097 - INFO - ========
========================================================================
発生場所 行:1 文字:53
+ ... ONUTF8="1"; python-api\.venv\Scripts\python.exe python-api\scripts\ev ...
+                 ~~~~~~~~~~~~~~~~~~~~~~~~~~~~~~~~~~~~~~~~~~~~~~~~~~~~~~~~~
    + CategoryInfo          : NotSpecified: (2026-05-08 14:1...=============== 
   :String) [], RemoteException
    + FullyQualifiedErrorId : NativeCommandError
 
2026-05-08 14:12:23,098 - INFO - app_config 繝ｭ繝ｼ繝蛾幕蟋・
2026-05-08 14:12:23,098 - INFO - 繝ｭ繧ｰ繝輔ぃ繧､繝ｫ: C:\Users\yuki2\Documents\ws\keiba
-ai-pro\python-api\optuna_debug.log
2026-05-08 14:12:23,098 - INFO - ==============================================
==================================
2026-05-08 14:12:23,112 - INFO - Supabase 繧ｯ繝ｩ繧､繧｢繝ｳ繝郁ｪｭ縺ｿ霎ｼ縺ｿ謌仙粥
2026-05-08 14:12:23,113 - INFO - Supabase 繝・・繧ｿ謫堺ｽ・ 辟｡蜉ｹ・郁ｪ崎ｨｼ蟆ら畑繝｢繝ｼ繝会ｼ・

======================================================================
縲仙ｭｦ鄙偵Μ繧ｯ繧ｨ繧ｹ繝亥女菫｡縲・
======================================================================
  target: win
  model_type: lightgbm
  use_optimizer: True
  use_optuna: True
  optuna_trials: 30
  cv_folds: 5
======================================================================

[14:12:23] (  3%) 繝・・繧ｿ繝吶・繧ｹ謗･邯壻ｸｭ...
[14:12:23] (  8%) 蟄ｦ鄙偵ョ繝ｼ繧ｿ隱ｭ縺ｿ霎ｼ縺ｿ荳ｭ...
2026-05-08 14:12:24,467 - INFO - training_data 隱ｭ縺ｿ霎ｼ縺ｿ: 2124 陦・
2026-05-08 14:12:24,474 - INFO - speed_figures 隱ｭ縺ｿ霎ｼ縺ｿ: 2948 陦・
竊・Ultimate DB縺九ｉ繝・・繧ｿ隱ｭ縺ｿ霎ｼ縺ｿ: C:\Users\yuki2\Documents\ws\keiba-ai-pro\keiba\data\keiba_ultimate.db
  邨ｶ蟇ｾ繝代せ: C:\Users\yuki2\Documents\ws\keiba-ai-pro\keiba\data\keiba_ultimate.db
  蟄伜惠繝√ぉ繝・け: True
  笞 _invalid_distance 繝ｬ繝ｼ繧ｹ繧偵せ繧ｭ繝・・: 49 繝ｬ繝ｼ繧ｹ
    (tools/fix_distance_zero.py 繧貞ｮ溯｡後☆繧九→菫ｮ豁｣繝ｻ蜀咲匳骭ｲ縺ｧ縺阪∪縺・
  笨・return_tables_ultimate: 2922繝ｬ繝ｼ繧ｹ縺ｮ驟榊ｽ捺ュ蝣ｱ繧偵Ο繝ｼ繝・
  笨・27290陦悟叙蠕・
  笞 _invalid_distance 繧ｨ繝ｳ繝医Μ繧偵せ繧ｭ繝・・: 74 莉ｶ
  笨・DataFrame螟画鋤: 27216陦・ﾃ・118蛻・
  笨・num_horses: 谺謳阪↑縺・(27216莉ｶ)
  笨・venue 繧ｳ繝ｼ繝芽ｧ｣豎ｺ: 26792莉ｶ
  笨・蝙句､画鋤螳御ｺ・ 謨ｰ蛟､=72蛻・ 譁・ｭ怜・=55蛻・ 蜷郁ｨ・127蛻・
  笨・distance: 27216莉ｶ蜿門ｾ・
  笨・surface: 27216莉ｶ蜿門ｾ・
DEBUG: Loaded 27216 rows from database
[14:12:24] ( 15%) 繝・・繧ｿ隱ｭ縺ｿ霎ｼ縺ｿ螳御ｺ・(27,216 陦・
[14:12:24] ( 20%) 迚ｹ蠕ｴ驥上お繝ｳ繧ｸ繝九い繝ｪ繝ｳ繧ｰ荳ｭ...

=== LightGBM譛驕ｩ蛹悶Δ繝ｼ繝・===
[14:12:34] ( 28%) 迚ｹ蠕ｴ驥城∈謚槭・譛驕ｩ蛹紋ｸｭ...
2026-05-08 14:12:35,177 - INFO - 譎らｳｻ蛻怜・蜑ｲ: 蟄ｦ鄙・4172陦・ 繝・せ繝・450陦・
  笞 [fix-A][隕∬ｪｿ譟ｻ] distance=0/NaN 縺梧ｮ句ｭ・ 7 莉ｶ 竊・荳ｭ螟ｮ蛟､ 1400m 縺ｧ邱頑･陬懷ｮ鯉ｼ域悽譚･縺ｯ繧ｹ繧ｭ繝・・蟇ｾ雎｡・・
     tools/fix_distance_zero.py --dry-run 縺ｧ蜴溷屏繧堤｢ｺ隱阪＠縺ｦ縺上□縺輔＞

================================================================================
縲伸ightGBM迚ｹ蠕ｴ驥乗怙驕ｩ蛹悶大ｭｦ鄙偵Δ繝ｼ繝・
================================================================================

縲・. 菴弱き繝ｼ繝・ぅ繝翫Μ繝・ぅ 繧ｫ繝・ざ繝ｪ繧ｫ繝ｫ螟画焚縲・
蜃ｦ逅・ Label Encoding 竊・LightGBM縺ｮcategorical_feature謖・ｮ・
  笨・venue                          竊・venue_encoded                  (14遞ｮ鬘・
  笨・venue_code                     竊・venue_code_encoded             (7遞ｮ鬘・
  笨・track_type                     竊・track_type_encoded             (1遞ｮ鬘・
  笨・surface                        竊・surface_encoded                (3遞ｮ鬘・
  笨・weather                        竊・weather_encoded                (4遞ｮ鬘・
  笨・field_condition                竊・field_condition_encoded        (4遞ｮ鬘・
  笨・race_class                     竊・race_class_encoded             (22遞ｮ鬘・
  笨・course_direction               竊・course_direction_encoded       (3遞ｮ鬘・
  笨・sex                            竊・sex_encoded                    (3遞ｮ鬘・
  笨・corner_radius                  竊・corner_radius_encoded          (1遞ｮ鬘・

  蜈・・繧ｫ繝・ざ繝ｪ繧ｫ繝ｫ繧ｫ繝ｩ繝繧貞炎髯､: ['venue', 'venue_code', 'track_type', 'surface', 'weather', 'field_condition', 'race_class', 'course_direction', 'sex', 'corner_radius']

縲・. 鬮倥き繝ｼ繝・ぅ繝翫Μ繝・ぅ譁・ｭ怜・蛻励・
蜃ｦ逅・ 蜑企勁・育ｵｱ險育音蠕ｴ驥上・ feature_engineering.py 縺ｧ險育ｮ玲ｸ医∩・・
  笨・jockey_name 竊・蜑企勁
  笨・trainer_name 竊・蜑企勁
  笨・horse_name 竊・蜑企勁
  笨・sire 竊・蜑企勁
  笨・dam 竊・蜑企勁
  笨・damsire 竊・蜑企勁

縲・. 謨ｰ蛟､螟画焚縲・
蜃ｦ逅・ 縺昴・縺ｾ縺ｾ菴ｿ逕ｨ・・ightGBM縺ｯ閾ｪ蜍輔〒繧ｹ繧ｱ繝ｼ繝ｪ繝ｳ繧ｰ荳崎ｦ・ｼ・
  笨・謨ｰ蛟､迚ｹ蠕ｴ驥・ 126蛟・
    - horse_number
    - bracket_number
    - horse_weight
    - horse_weight_change
    - weight_change
    - age
    - odds
    - popularity
    - distance
    - num_horses
    ... 莉・16蛟・

縲・. 繝舌う繝翫Μ迚ｹ蠕ｴ驥上・
蜃ｦ逅・ 縺昴・縺ｾ縺ｾ菴ｿ逕ｨ・・/1繧ｨ繝ｳ繧ｳ繝ｼ繝画ｸ医∩・・
  笨・繝舌う繝翫Μ迚ｹ蠕ｴ驥・ 5蛟・

縲・. 繝ｪ繧ｹ繝亥梛螟画焚縲・
蜃ｦ逅・ 邨ｱ險亥､・亥ｹｳ蝮・∝・謨｣縺ｪ縺ｩ・峨↓螟画鋤

縲・. 繝繝溘・螟画焚縲・
蜃ｦ逅・ 縺昴・縺ｾ縺ｾ菴ｿ逕ｨ・域里縺ｫ繝舌う繝翫Μ蛹匁ｸ医∩・・
  笨・諤ｧ蛻･繝繝溘・: ['sex_age', 'sex_繧ｻ', 'sex_迚・, 'sex_迚｡', 'sex_code', 'sex_encoded']
  笨・繝壹・繧ｹ繝繝溘・: ['pace_advantage']
  笨・莨鷹､頑悄髢薙ム繝溘・: ['rest_category', 'rest_short', 'rest_normal', 'rest_long', 'rest_very_long']

縲・. ID邉ｻ螟画焚縲・
蜃ｦ逅・ 縺昴・縺ｾ縺ｾ菫晄戟・育ｵｱ險郁ｨ育ｮ励↓菴ｿ逕ｨ縲∝ｭｦ鄙呈凾縺ｯ髯､螟匁耳螂ｨ・・
  笨・ID迚ｹ蠕ｴ驥・ ['race_id', 'horse_id', 'jockey_id', 'trainer_id']
    竊・蟄ｦ鄙呈凾縺ｫ縺ｯ縺薙ｌ繧峨ｒ髯､螟悶＠縺ｦ縺上□縺輔＞

縲・. 譌･譎ょ､画焚縲・
蜃ｦ逅・ 謨ｰ蛟､蛹厄ｼ亥ｹｴ/譛・譌･/譖懈律縺ｪ縺ｩ・・
  笨・date 竊・date_year, date_month, date_day, date_dayofweek

縲・. 荳崎ｦ√↑螟画焚・亥炎髯､謗ｨ螂ｨ・峨・
  笨・post_time 竊・蜑企勁
  笨・horse_url 竊・蜑企勁
  笨・jockey_url 竊・蜑企勁
  笨・trainer_url 竊・蜑企勁
  笨・time 竊・蜑企勁
  笨・horse_owner 竊・蜑企勁
  笨・horse_breeder 竊・蜑企勁
  笨・horse_breeding_farm 竊・蜑企勁
  笨・horse_birth_date 竊・蜑企勁
  笨・surface_ja 竊・蜑企勁
  笨・surface_en 竊・蜑企勁
  笨・sex_age 竊・蜑企勁
  笨・race_date 竊・蜑企勁
  笨・weight 竊・蜑企勁
  笨・prev_race_venue 竊・蜑企勁
  笨・prev2_race_venue 竊・蜑企勁
  笨・prev3_race_venue 竊・蜑企勁
  笨・prev4_race_venue 竊・蜑企勁
  笨・prev5_race_venue 竊・蜑企勁
  笨・prev_race_date 竊・蜑企勁
  笨・prev2_race_date 竊・蜑企勁
  笨・prev3_race_date 竊・蜑企勁
  笨・prev4_race_date 竊・蜑企勁
  笨・prev5_race_date 竊・蜑企勁
  笨・race_name 竊・蜑企勁
  笨・horse_distance_win_rate 竊・蜑企勁
  笨・horse_distance_avg_finish 竊・蜑企勁
  笨・distance_increased 竊・蜑企勁
  笨・distance_decreased 竊・蜑企勁
  笨・weight_kg 竊・蜑企勁
  笨・weight_change 竊・蜑企勁
  笨・jockey_weight 竊・蜑企勁
  笨・n_horses 竊・蜑企勁
  笨・prev_race_time 竊・蜑企勁
  笨・tansho_payout 竊・蜑企勁
  笨・sanrentan_payout 竊・蜑企勁
  笨・fukusho_min_payout 竊・蜑企勁
  笨・fukusho_max_payout 竊・蜑企勁
  笨・tansho_payout_log 竊・蜑企勁
  笨・sanrentan_payout_log 竊・蜑企勁
  笨・sanrentan_z_in_races 竊・蜑企勁
  笨・tansho_implied_prob 竊・蜑企勁
  笨・tansho_payout_is_missing 竊・蜑企勁
  笨・sanrentan_payout_is_missing 竊・蜑企勁
  笨・is_surface_change 竊・蜑企勁
  笨・implied_prob_norm 竊・蜑企勁
  笨・odds_rank_in_race 竊・蜑企勁
  笨・horse_win_rate 竊・蜑企勁
  笨・horse_win_rate_is_missing 竊・蜑企勁
  笨・horse_total_wins 竊・蜑企勁
  笨・horse_total_runs 竊・蜑企勁
  笨・horse_total_prize_money 竊・蜑企勁
  笨・popularity_is_missing 竊・蜑企勁
  笨・odds_is_missing 竊・蜑企勁
  笨・prev_race_finish_is_missing 竊・蜑企勁
  笨・prev2_race_finish_is_missing 竊・蜑企勁
  笨・prev_race_distance_is_missing 竊・蜑企勁
  笨・prev2_race_distance_is_missing 竊・蜑企勁
  笨・prev_race_time_is_missing 竊・蜑企勁
  笨・prev_speed_index_is_missing 竊・蜑企勁
  笨・prev_speed_zscore_is_missing 竊・蜑企勁
  笨・race_class_num_is_missing 竊・蜑企勁
  笨・days_since_last_race_is_missing 竊・蜑企勁
  笨・is_young 竊・蜑企勁
  笨・is_prime 竊・蜑企勁
  笨・is_veteran 竊・蜑企勁
  笨・inner_advantage 竊・蜑企勁
  笨・inner_bias 竊・蜑企勁
  笨・rest_category 竊・蜑企勁
  笨・rest_short 竊・蜑企勁
  笨・rest_normal 竊・蜑企勁
  笨・rest_long 竊・蜑企勁
  笨・rest_very_long 竊・蜑企勁
  笨・season 竊・蜑企勁
  笨・age 竊・蜑企勁
  笨・prev2_speed_zscore_is_missing 竊・蜑企勁
  笨・prev_race_weight 竊・蜑企勁
  笨・prev2_race_weight 竊・蜑企勁
  笨・burden_weight 竊・蜑企勁
  笨・prev_race_time_seconds 竊・蜑企勁
  笨・prev2_race_time 竊・蜑企勁
  笨・bracket_number 竊・蜑企勁
  笨・straight_length 竊・蜑企勁
  笨・horse_surface_win_rate 竊・蜑企勁
  笨・horse_surface_races 竊・蜑企勁
  笨・horse_dist_band_win_rate 竊・蜑企勁
  笨・horse_dist_band_races 竊・蜑企勁
  笨・horse_venue_win_rate 竊・蜑企勁
  笨・horse_venue_races 竊・蜑企勁
  笨・horse_distance_races 竊・蜑企勁
  笨・horse_venue_surface_win_rate 竊・蜑企勁
  笨・horse_venue_surface_races 竊・蜑企勁
  笨・horse_dist_surface_win_rate 竊・蜑企勁
  笨・horse_dist_surface_races 竊・蜑企勁
  笨・past5_avg_finish 竊・蜑企勁
  笨・past10_avg_finish 竊・蜑企勁
  笨・past3_win_rate 竊・蜑企勁
  笨・past5_win_rate 竊・蜑企勁
  笨・past3_avg_last3f_rank 竊・蜑企勁
  笨・past5_avg_last3f_time 竊・蜑企勁
  笨・past3_avg_last3f_time 竊・蜑企勁
  笨・is_first_race 竊・蜑企勁
  笨・fe_trainer_win_rate 竊・蜑企勁
  笨・jt_combo_win_rate 竊・蜑企勁
  笨・trainer_place_rate_top2 竊・蜑企勁
  笨・jockey_place_rate_top2 竊・蜑企勁
  笨・surface_encoded 竊・蜑企勁
  笨・track_type_encoded 竊・蜑企勁
  笨・course_direction_encoded 竊・蜑企勁
  笨・corner_radius_encoded 竊・蜑企勁
  笨・prev2_speed_index_is_missing 竊・蜑企勁
  笨・jt_combo_races 竊・蜑企勁
  笨・race_class_num 竊・蜑企勁
  笨・odds_z_in_race 竊・蜑企勁
  笨・popularity_normalized 竊・蜑企勁
  笨・top3_probability 竊・蜑企勁
  笨・implied_prob 竊・蜑企勁
  笨・popularity 竊・蜑企勁
  笨・prev2_speed_index 竊・蜑企勁
  笨・prev2_speed_zscore 竊・蜑企勁
  笨・jockey_show_rate 竊・蜑企勁
  笨・trainer_show_rate 竊・蜑企勁
  笨・諤ｧ蛻･繝繝溘・・磯㍾隍・ｼ牙炎髯､: ['sex_繧ｻ', 'sex_迚・, 'sex_迚｡', 'sex_code']

  笞・・ 谺謳咲紫90%雜・・蛻励ｒ髯､蜴ｻ (38蛻・: ['weight_diff', '_shutuba', 'running_style', 'running_style_num', 'lap_200m', 'lap_400m', 'lap_600m', 'lap_800m']...
  笞・・ [fix-D] 繧ｼ繝ｭ蛻・淵蛻励ｒ髯､蜴ｻ (22蛻・: ['running_style_std_5', 'race_avg_prev_speed_is_missing', 'race_max_prev_speed_is_missing', 'horse_speed_rank_pct_is_missing', 'race_avg_prev_finish_is_missing', 'sire_surface_win_rate_is_missing', 'sire_dist_band_win_rate_is_missing', 'damsire_surface_win_rate_is_missing', 'damsire_dist_band_win_rate_is_missing', 'running_style_std_5_is_missing', 'horse_field_win_rate_is_missing', 'horse_field_races_is_missing', 'horse_weather_win_rate_is_missing', 'horse_weather_races_is_missing', 'jockey_field_win_rate_is_missing', 'jockey_field_races_is_missing', 'sire_field_win_rate_is_missing', 'sire_field_races_is_missing', 'damsire_field_win_rate_is_missing', 'damsire_field_races_is_missing', 'kai_num_is_missing', 'day_num_is_missing']

================================================================================
縲先怙驕ｩ蛹門ｮ御ｺ・・
================================================================================
  蜈・・繧ｫ繝ｩ繝謨ｰ: 152蛟・
  繧ｫ繝・ざ繝ｪ繧ｫ繝ｫ迚ｹ蠕ｴ驥・ 10蛟・
    竊・LightGBM縺ｮcategorical_feature蠑墓焚縺ｫ謖・ｮ・ ['venue_encoded', 'venue_code_encoded', 'track_type_encoded', 'surface_encoded', 'weather_encoded']...

  謗ｨ螂ｨLightGBM繝代Λ繝｡繝ｼ繧ｿ:
    'categorical_feature': ['venue_encoded', 'venue_code_encoded', 'track_type_encoded', 'surface_encoded', 'weather_encoded', 'field_condition_encoded', 'race_class_encoded', 'course_direction_encoded', 'sex_encoded', 'corner_radius_encoded']
    'max_cat_to_onehot': 4  # 4遞ｮ鬘樔ｻ･荳九・閾ｪ蜍輔〒繝ｯ繝ｳ繝帙ャ繝亥喧
================================================================================

[14:12:35] ( 35%) CV蟄ｦ鄙剃ｸｭ (5謚・...
[14:12:35] ( 35%) CV 5謚・窶・繝ｩ繧ｦ繝ｳ繝・0/1000
[14:12:35] ( 35%) CV 5謚・窶・繝ｩ繧ｦ繝ｳ繝・20/1000
[14:12:35] ( 35%) CV 5謚・窶・繝ｩ繧ｦ繝ｳ繝・40/1000
[14:12:35] ( 36%) CV 5謚・窶・繝ｩ繧ｦ繝ｳ繝・60/1000
[14:12:35] ( 36%) CV 5謚・窶・繝ｩ繧ｦ繝ｳ繝・80/1000
[14:12:36] ( 37%) CV 5謚・窶・繝ｩ繧ｦ繝ｳ繝・100/1000
[14:12:36] ( 60%) 譛邨ゅΔ繝・Ν蟄ｦ鄙剃ｸｭ...
[14:12:36] ( 60%) 譛邨ゅΔ繝・Ν 窶・繝ｩ繧ｦ繝ｳ繝・0/70
[14:12:36] ( 61%) 譛邨ゅΔ繝・Ν 窶・繝ｩ繧ｦ繝ｳ繝・20/70
[14:12:36] ( 62%) 譛邨ゅΔ繝・Ν 窶・繝ｩ繧ｦ繝ｳ繝・40/70
[14:12:36] ( 64%) 譛邨ゅΔ繝・Ν 窶・繝ｩ繧ｦ繝ｳ繝・60/70

=== Optuna繝上う繝代・繝代Λ繝｡繝ｼ繧ｿ譛驕ｩ蛹・===
[14:12:36] ( 65%) Optuna譛驕ｩ蛹紋ｸｭ (30隧ｦ陦・...
[I 2026-05-08 14:12:36,271] A new study created in memory with name: lightgbm_o
ptimization

[OPT-001] optimize()繝｡繧ｽ繝・ラ髢句ｧ・
[OPT-002] X.shape=(4622, 145), y.shape=(4622,)
[OPT-003] n_trials=30, cv_folds=5

======================================================================
  Optuna 繝上う繝代・繝代Λ繝｡繝ｼ繧ｿ譛驕ｩ蛹夜幕蟋・
======================================================================
  隧ｦ陦悟屓謨ｰ: 30
  CV繝輔か繝ｼ繝ｫ繝・ 5
  繝・・繧ｿ謨ｰ: 4622陦・ﾃ・145蛻・
  繧ｫ繝・ざ繝ｪ繧ｫ繝ｫ迚ｹ蠕ｴ驥・ 6蛟・
  繧ｿ繧､繝繧｢繧ｦ繝・ 300遘・
======================================================================

[OPT-004] 繧ｹ繧ｿ繝・ぅ菴懈・髢句ｧ・
[OPT-005] 繧ｹ繧ｿ繝・ぅ菴懈・螳御ｺ・
[OPT-006] 笘・・笘・study.optimize()蜻ｼ縺ｳ蜃ｺ縺礼峩蜑・笘・・笘・

  0%|          | 0/30 [00:00<?, ?it/s]
                                      

  0%|          | 0/30 [00:00<?, ?it/s]
Best trial: 0. Best value: 0.882179:   0%|          | 0/30 [00:00<?, ?it/s]
Best trial: 0. Best value: 0.882179:   3%|笆・        | 1/30 [00:00<00:18,  1.60i
t/s]
Best trial: 0. Best value: 0.882179:   3%|笆・        | 1/30 [00:00<00:18,  1.60i
t/s, 0.62/300 seconds]
                                                                               
                      

Best trial: 0. Best value: 0.882179:   3%|笆・        | 1/30 [00:02<00:18,  1.60i
t/s, 0.62/300 seconds]
Best trial: 0. Best value: 0.882179:   3%|笆・        | 1/30 [00:02<00:18,  1.60i
t/s, 0.62/300 seconds]
Best trial: 0. Best value: 0.882179:   7%|笆・        | 2/30 [00:02<00:37,  1.35s
/it, 0.62/300 seconds]
Best trial: 0. Best value: 0.882179:   7%|笆・        | 2/30 [00:02<00:37,  1.35s
/it, 2.49/300 seconds]
                                                                               
                      

Best trial: 0. Best value: 0.882179:   7%|笆・        | 2/30 [00:02<00:37,  1.35s
/it, 2.49/300 seconds]
Best trial: 0. Best value: 0.882179:   7%|笆・        | 2/30 [00:02<00:37,  1.35s
/it, 2.49/300 seconds]
Best trial: 0. Best value: 0.882179:  10%|笆・        | 3/30 [00:02<00:26,  1.03i
t/s, 2.49/300 seconds]
Best trial: 0. Best value: 0.882179:  10%|笆・        | 3/30 [00:02<00:26,  1.03i
t/s, 3.00/300 seconds]
                                                                               
                      

Best trial: 0. Best value: 0.882179:  10%|笆・        | 3/30 [00:03<00:26,  1.03i
t/s, 3.00/300 seconds]
Best trial: 0. Best value: 0.882179:  10%|笆・        | 3/30 [00:03<00:26,  1.03i
t/s, 3.00/300 seconds]
Best trial: 0. Best value: 0.882179:  13%|笆遺鮪        | 4/30 [00:03<00:24,  1.08
it/s, 3.00/300 seconds]
Best trial: 0. Best value: 0.882179:  13%|笆遺鮪        | 4/30 [00:03<00:24,  1.08
it/s, 3.87/300 seconds]
                                                                               
                      

Best trial: 0. Best value: 0.882179:  13%|笆遺鮪        | 4/30 [00:04<00:24,  1.08
it/s, 3.87/300 seconds]
Best trial: 0. Best value: 0.882179:  13%|笆遺鮪        | 4/30 [00:04<00:24,  1.08
it/s, 3.87/300 seconds]
Best trial: 0. Best value: 0.882179:  17%|笆遺幕        | 5/30 [00:04<00:19,  1.31
it/s, 3.87/300 seconds]
Best trial: 0. Best value: 0.882179:  17%|笆遺幕        | 5/30 [00:04<00:19,  1.31
it/s, 4.34/300 seconds]
                                                                               
                      

Best trial: 0. Best value: 0.882179:  17%|笆遺幕        | 5/30 [00:11<00:19,  1.31
it/s, 4.34/300 seconds]
Best trial: 0. Best value: 0.882179:  17%|笆遺幕        | 5/30 [00:11<00:19,  1.31
it/s, 4.34/300 seconds]
Best trial: 0. Best value: 0.882179:  20%|笆遺毎        | 6/30 [00:11<01:07,  2.80
s/it, 4.34/300 seconds]
Best trial: 0. Best value: 0.882179:  20%|笆遺毎        | 6/30 [00:11<01:07,  2.80
s/it, 11.10/300 seconds]
                                                                               
                       

Best trial: 0. Best value: 0.882179:  20%|笆遺毎        | 6/30 [00:12<01:07,  2.80
s/it, 11.10/300 seconds]
Best trial: 0. Best value: 0.882179:  20%|笆遺毎        | 6/30 [00:12<01:07,  2.80
s/it, 11.10/300 seconds]
Best trial: 0. Best value: 0.882179:  23%|笆遺毎笆・      | 7/30 [00:12<00:53,  2.33
s/it, 11.10/300 seconds]
Best trial: 0. Best value: 0.882179:  23%|笆遺毎笆・      | 7/30 [00:12<00:53,  2.33
s/it, 12.46/300 seconds]
                                                                               
                       

Best trial: 0. Best value: 0.882179:  23%|笆遺毎笆・      | 7/30 [00:13<00:53,  2.33
s/it, 12.46/300 seconds]
Best trial: 7. Best value: 0.886715:  23%|笆遺毎笆・      | 7/30 [00:13<00:53,  2.33
s/it, 12.46/300 seconds]
Best trial: 7. Best value: 0.886715:  27%|笆遺毎笆・      | 8/30 [00:13<00:43,  1.97
s/it, 12.46/300 seconds]
Best trial: 7. Best value: 0.886715:  27%|笆遺毎笆・      | 8/30 [00:13<00:43,  1.97
s/it, 13.65/300 seconds]
                                                                               
                       

Best trial: 7. Best value: 0.886715:  27%|笆遺毎笆・      | 8/30 [00:14<00:43,  1.97
s/it, 13.65/300 seconds]
Best trial: 7. Best value: 0.886715:  27%|笆遺毎笆・      | 8/30 [00:14<00:43,  1.97
s/it, 13.65/300 seconds]
Best trial: 7. Best value: 0.886715:  30%|笆遺毎笆・      | 9/30 [00:14<00:32,  1.54
s/it, 13.65/300 seconds]
Best trial: 7. Best value: 0.886715:  30%|笆遺毎笆・      | 9/30 [00:14<00:32,  1.54
s/it, 14.25/300 seconds]
                                                                               
                       

Best trial: 7. Best value: 0.886715:  30%|笆遺毎笆・      | 9/30 [00:17<00:32,  1.54
s/it, 14.25/300 seconds]
Best trial: 7. Best value: 0.886715:  30%|笆遺毎笆・      | 9/30 [00:17<00:32,  1.54
s/it, 14.25/300 seconds]
Best trial: 7. Best value: 0.886715:  33%|笆遺毎笆遺鮪      | 10/30 [00:17<00:40,  2.
02s/it, 14.25/300 seconds]
Best trial: 7. Best value: 0.886715:  33%|笆遺毎笆遺鮪      | 10/30 [00:17<00:40,  2.
02s/it, 17.33/300 seconds]
                                                                               
                        

Best trial: 7. Best value: 0.886715:  33%|笆遺毎笆遺鮪      | 10/30 [00:17<00:40,  2.
02s/it, 17.33/300 seconds]
Best trial: 10. Best value: 0.893625:  33%|笆遺毎笆遺鮪      | 10/30 [00:17<00:40,  2
.02s/it, 17.33/300 seconds]
Best trial: 10. Best value: 0.893625:  37%|笆遺毎笆遺幕      | 11/30 [00:17<00:29,  1
.57s/it, 17.33/300 seconds]
Best trial: 10. Best value: 0.893625:  37%|笆遺毎笆遺幕      | 11/30 [00:17<00:29,  1
.57s/it, 17.90/300 seconds]
                                                                               
                         

Best trial: 10. Best value: 0.893625:  37%|笆遺毎笆遺幕      | 11/30 [00:18<00:29,  1
.57s/it, 17.90/300 seconds]
Best trial: 10. Best value: 0.893625:  37%|笆遺毎笆遺幕      | 11/30 [00:18<00:29,  1
.57s/it, 17.90/300 seconds]
Best trial: 10. Best value: 0.893625:  40%|笆遺毎笆遺毎      | 12/30 [00:18<00:23,  1
.28s/it, 17.90/300 seconds]
Best trial: 10. Best value: 0.893625:  40%|笆遺毎笆遺毎      | 12/30 [00:18<00:23,  1
.28s/it, 18.52/300 seconds]
                                                                               
                         

Best trial: 10. Best value: 0.893625:  40%|笆遺毎笆遺毎      | 12/30 [00:19<00:23,  1
.28s/it, 18.52/300 seconds]
Best trial: 10. Best value: 0.893625:  40%|笆遺毎笆遺毎      | 12/30 [00:19<00:23,  1
.28s/it, 18.52/300 seconds]
Best trial: 10. Best value: 0.893625:  43%|笆遺毎笆遺毎笆・    | 13/30 [00:19<00:17,  1
.04s/it, 18.52/300 seconds]
Best trial: 10. Best value: 0.893625:  43%|笆遺毎笆遺毎笆・    | 13/30 [00:19<00:17,  1
.04s/it, 19.01/300 seconds]
                                                                               
                         

Best trial: 10. Best value: 0.893625:  43%|笆遺毎笆遺毎笆・    | 13/30 [00:19<00:17,  1
.04s/it, 19.01/300 seconds]
Best trial: 10. Best value: 0.893625:  43%|笆遺毎笆遺毎笆・    | 13/30 [00:19<00:17,  1
.04s/it, 19.01/300 seconds]
Best trial: 10. Best value: 0.893625:  47%|笆遺毎笆遺毎笆・    | 14/30 [00:19<00:13,  1
.20it/s, 19.01/300 seconds]
Best trial: 10. Best value: 0.893625:  47%|笆遺毎笆遺毎笆・    | 14/30 [00:19<00:13,  1
.20it/s, 19.35/300 seconds]
                                                                               
                         

Best trial: 10. Best value: 0.893625:  47%|笆遺毎笆遺毎笆・    | 14/30 [00:20<00:13,  1
.20it/s, 19.35/300 seconds]
Best trial: 10. Best value: 0.893625:  47%|笆遺毎笆遺毎笆・    | 14/30 [00:20<00:13,  1
.20it/s, 19.35/300 seconds]
Best trial: 10. Best value: 0.893625:  50%|笆遺毎笆遺毎笆・    | 15/30 [00:20<00:12,  1
.17it/s, 19.35/300 seconds]
Best trial: 10. Best value: 0.893625:  50%|笆遺毎笆遺毎笆・    | 15/30 [00:20<00:12,  1
.17it/s, 20.25/300 seconds]
                                                                               
                         

Best trial: 10. Best value: 0.893625:  50%|笆遺毎笆遺毎笆・    | 15/30 [00:21<00:12,  1
.17it/s, 20.25/300 seconds]
Best trial: 10. Best value: 0.893625:  50%|笆遺毎笆遺毎笆・    | 15/30 [00:21<00:12,  1
.17it/s, 20.25/300 seconds]
Best trial: 10. Best value: 0.893625:  53%|笆遺毎笆遺毎笆遺鮪    | 16/30 [00:21<00:14,  
1.01s/it, 20.25/300 seconds]
Best trial: 10. Best value: 0.893625:  53%|笆遺毎笆遺毎笆遺鮪    | 16/30 [00:21<00:14,  
1.01s/it, 21.62/300 seconds]
                                                                               
                         

Best trial: 10. Best value: 0.893625:  53%|笆遺毎笆遺毎笆遺鮪    | 16/30 [00:22<00:14,  
1.01s/it, 21.62/300 seconds]
Best trial: 10. Best value: 0.893625:  53%|笆遺毎笆遺毎笆遺鮪    | 16/30 [00:22<00:14,  
1.01s/it, 21.62/300 seconds]
Best trial: 10. Best value: 0.893625:  57%|笆遺毎笆遺毎笆遺幕    | 17/30 [00:22<00:11,  
1.16it/s, 21.62/300 seconds]
Best trial: 10. Best value: 0.893625:  57%|笆遺毎笆遺毎笆遺幕    | 17/30 [00:22<00:11,  
1.16it/s, 22.16/300 seconds]
                                                                               
                         

Best trial: 10. Best value: 0.893625:  57%|笆遺毎笆遺毎笆遺幕    | 17/30 [00:23<00:11,  
1.16it/s, 22.16/300 seconds]
Best trial: 10. Best value: 0.893625:  57%|笆遺毎笆遺毎笆遺幕    | 17/30 [00:23<00:11,  
1.16it/s, 22.16/300 seconds]
Best trial: 10. Best value: 0.893625:  60%|笆遺毎笆遺毎笆遺毎    | 18/30 [00:23<00:11,  
1.07it/s, 22.16/300 seconds]
Best trial: 10. Best value: 0.893625:  60%|笆遺毎笆遺毎笆遺毎    | 18/30 [00:23<00:11,  
1.07it/s, 23.26/300 seconds]
                                                                               
                         

Be