[I 2026-05-08 14:17:05,324] Trial 29 finished with value: -0.724991899472082 and parameters: {'n_estimators': 242, 'boosting_type': 'gbdt', 'num_leaves': 48, 'max_depth': 10, 'min_child_samples': 80, 'min_child_weight': 0.04045749403061442, 'learning_rate': 0.006987314670173023, 'reg_alpha': 0.0009394302263346657, 'reg_lambda': 5.168836271995951e-07, 'subsample': 0.867321917234575, 'subsample_freq': 6, 'colsample_bytree': 0.7065070693270564, 'max_cat_to_onehot': 10}. Best is trial 11 with value: -0.9521599966025903.
[OPT-007] 笘・・笘・study.optimize()蜻ｼ縺ｳ蜃ｺ縺怜ｮ御ｺ・笘・・笘・
[OPT-007] 笘・・笘・study.optimize()蜻ｼ縺ｳ蜃ｺ縺怜ｮ御ｺ・笘・・笘・
[OPT-008] 邨先棡菫晏ｭ倬幕蟋・
[OPT-009] best_score=-0.9522
[OPT-010] 螻･豁ｴ菫晏ｭ伜ｮ御ｺ・ 30隧ｦ陦・

======================================================================
  譛驕ｩ蛹門ｮ御ｺ・
======================================================================
  譛濶ｯ繧ｹ繧ｳ繧｢: -0.9522
  螳御ｺ・ｩｦ陦梧焚: 30
  譫晏・繧願ｩｦ陦梧焚: 0

  譛驕ｩ繝代Λ繝｡繝ｼ繧ｿ:
    n_estimators: 140
    boosting_type: dart
    num_leaves: 79
    max_depth: 8
    min_child_samples: 73
    min_child_weight: 0.00746641201585721
    learning_rate: 0.0010327788094764748
    reg_alpha: 3.459150005782469e-06
    reg_lambda: 2.9536889586486034e-06
    subsample: 0.9920773352883635
    subsample_freq: 5
    colsample_bytree: 0.6860854659284155
    max_cat_to_onehot: 9
    drop_rate: 0.25711146158659437
    skip_drop: 0.0014759474439721178
======================================================================

[14:17:05] ( 67%) Optuna CV 5謚・窶・繝ｩ繧ｦ繝ｳ繝・0/140
[14:17:06] ( 68%) Optuna CV 5謚・窶・繝ｩ繧ｦ繝ｳ繝・20/140
[14:17:06] ( 70%) Optuna CV 5謚・窶・繝ｩ繧ｦ繝ｳ繝・40/140
[14:17:07] ( 72%) Optuna CV 5謚・窶・繝ｩ繧ｦ繝ｳ繝・60/140
[14:17:08] ( 73%) Optuna CV 5謚・窶・繝ｩ繧ｦ繝ｳ繝・80/140
[14:17:09] ( 75%) Optuna CV 5謚・窶・繝ｩ繧ｦ繝ｳ繝・100/140
[14:17:11] ( 77%) Optuna CV 5謚・窶・繝ｩ繧ｦ繝ｳ繝・120/140
[14:17:12] ( 82%) Optuna繝代Λ繝｡繝ｼ繧ｿ縺ｧ繝｢繝・Ν蜀榊ｭｦ鄙剃ｸｭ...
[14:17:12] ( 82%) Optuna譛邨ゅΔ繝・Ν 窶・繝ｩ繧ｦ繝ｳ繝・0/175
[14:17:12] ( 82%) Optuna譛邨ゅΔ繝・Ν 窶・繝ｩ繧ｦ繝ｳ繝・20/175
[14:17:12] ( 83%) Optuna譛邨ゅΔ繝・Ν 窶・繝ｩ繧ｦ繝ｳ繝・40/175
[14:17:12] ( 83%) Optuna譛邨ゅΔ繝・Ν 窶・繝ｩ繧ｦ繝ｳ繝・60/175
[14:17:13] ( 84%) Optuna譛邨ゅΔ繝・Ν 窶・繝ｩ繧ｦ繝ｳ繝・80/175
[14:17:13] ( 84%) Optuna譛邨ゅΔ繝・Ν 窶・繝ｩ繧ｦ繝ｳ繝・100/175
[14:17:13] ( 85%) Optuna譛邨ゅΔ繝・Ν 窶・繝ｩ繧ｦ繝ｳ繝・120/175
[14:17:13] ( 86%) Optuna譛邨ゅΔ繝・Ν 窶・繝ｩ繧ｦ繝ｳ繝・140/175
[14:17:14] ( 86%) Optuna譛邨ゅΔ繝・Ν 窶・繝ｩ繧ｦ繝ｳ繝・160/175
2026-05-08 14:17:16,023 - INFO - [貂ｩ蠎ｦ繧ｭ繝｣繝ｪ繝悶Ξ繝ｼ繧ｷ繝ｧ繝ｳ] 譛驕ｩ T = 0.0498
2026-05-08 14:17:16,074 - INFO - [隧穂ｾ｡謖・ｨ兢 Spearman_ﾏ・0.6608, RMSE=0.9560, Top-
1=0.4545, T=0.0498
[14:17:16] ( 88%) 遒ｺ邇・く繝｣繝ｪ繝悶Ξ繝ｼ繧ｷ繝ｧ繝ｳ荳ｭ...
[14:17:16] ( 93%) 繝｢繝・Ν繧剃ｿ晏ｭ倅ｸｭ...
[14:17:16] ( 98%) 蟄ｦ鄙貞ｮ御ｺ・
[14:17:16]   蟄ｦ鄙貞ｮ御ｺ・
[14:17:16]     model_id     : 20130101_20260411_20260508_1417
[14:17:16]     data_count   : 25448
[14:17:16]     race_count   : 2306
[14:17:16]     feature_count: 152
[14:17:16]     AUC          : 0.6607694492900263
[14:17:16]     CV AUC       : 0.6607694492900263
[14:17:16]     LogLoss      : 0.9559950088210999
[14:17:16] ============================================================
[14:17:16] STEP C: 隧穂ｾ｡繝ｬ繝昴・繝・
[14:17:16] ============================================================
[14:17:16] 
隧穂ｾ｡繝ｬ繝昴・繝井ｿ晏ｭ・ C:\Users\yuki2\Documents\ws\keiba-ai-pro\docs\reports\eval_1year_report_20260508_1417.md
[14:17:16] 繝｡繝医Μ繧ｯ繧ｹ JSON 菫晏ｭ・ C:\Users\yuki2\Documents\ws\keiba-ai-pro\docs\reports\eval_1year_metrics_20260508_1417.json
[14:17:16] 
============================================================
[14:17:16] 繝代う繝励Λ繧､繝ｳ螳御ｺ・
[14:17:16] ============================================================
[14:17:16] 繝ｭ繧ｰ菫晏ｭ・ C:\Users\yuki2\Documents\ws\keiba-ai-pro\docs\reports\eval_1year_direct_20260508_1417.txt





