[I 2026-05-08 14:12:36,895] Trial 0 finished with value: 0.8821785985050076 and parameters: {'n_estimators': 218, 'boosting_type': 'gbdt', 'num_leaves': 128, 'max_depth': 4, 'min_child_samples': 19, 'min_child_weight': 0.00014936568554617635, 'learning_rate': 0.05399484409787434, 'reg_alpha': 0.002570603566117598, 'reg_lambda': 0.023585940584142682, 'subsample': 0.5102922471479012, 'subsample_freq': 7, 'colsample_bytree': 0.9162213204002109, 'max_cat_to_onehot': 3}. Best is trial 0 with value: 0.8821785985050076.
[I 2026-05-08 14:12:38,759] Trial 1 finished with value: 0.8694792983274908 and parameters: {'n_estimators': 132, 'boosting_type': 'dart', 'num_leaves': 114, 'max_depth': 7, 'min_child_samples': 32, 'min_child_weight': 0.006847920095574782, 'learning_rate': 0.0019010245319870357, 'reg_alpha': 4.258943089524393e-06, 'reg_lambda': 1.9826980964985924e-05, 'subsample': 0.728034992108518, 'subsample_freq': 6, 'colsample_bytree': 0.5998368910791798, 'max_cat_to_onehot': 6, 'drop_rate': 0.29620728443102123, 'skip_drop': 0.023225206359998862}. Best is trial 0 with value: 0.8821785985050076.
[I 2026-05-08 14:12:39,271] Trial 2 finished with value: 0.8770566522660965 and parameters: {'n_estimators': 324, 'boosting_type': 'gbdt', 'num_leaves': 191, 'max_depth': 12, 'min_child_samples': 82, 'min_child_weight': 0.0008200518402245837, 'learning_rate': 0.0015679933916723015, 'reg_alpha': 0.014391207615728067, 'reg_lambda': 9.148975058772307e-05, 'subsample': 0.5610191174223894, 'subsample_freq': 3, 'colsample_bytree': 0.5171942605576092, 'max_cat_to_onehot': 10}. Best is trial 0 with value: 0.8821785985050076.
[I 2026-05-08 14:12:40,141] Trial 3 finished with value: 0.88054943545944 and parameters: {'n_estimators': 166, 'boosting_type': 'gbdt', 'num_leaves': 114, 'max_depth': 8, 'min_child_samples': 22, 'min_child_weight': 0.08105016126411585, 'learning_rate': 0.035503048581283086, 'reg_alpha': 2.854239907497756, 'reg_lambda': 1.1309571585271483, 'subsample': 0.7989499894055425, 'subsample_freq': 7, 'colsample_bytree': 0.5442462510259598, 'max_cat_to_onehot': 3}. Best is trial 0 with value: 0.8821785985050076.
[I 2026-05-08 14:12:40,611] Trial 4 finished with value: 0.8655919003274682 and parameters: {'n_estimators': 70, 'boosting_type': 'dart', 'num_leaves': 69, 'max_depth': 11, 'min_child_samples': 39, 'min_child_weight': 0.0006963114377829289, 'learning_rate': 0.012172847081122434, 'reg_alpha': 1.8548894229694903e-07, 'reg_lambda': 0.16587190283399655, 'subsample': 0.5372753218398854, 'subsample_freq': 7, 'colsample_bytree': 0.8861223846483287, 'max_cat_to_onehot': 3, 'drop_rate': 0.0027610585618011996, 'skip_drop': 0.4077307142274171}. Best is trial 0 with value: 0.8821785985050076.
[I 2026-05-08 14:12:47,368] Trial 5 finished with value: 0.8684809857206854 and parameters: {'n_estimators': 368, 'boosting_type': 'dart', 'num_leaves': 33, 'max_depth': 6, 'min_child_samples': 16, 'min_child_weight': 0.038842777547031436, 'learning_rate': 0.01764396768338155, 'reg_alpha': 9.507847858536042e-06, 'reg_lambda': 3.732717755563729e-08, 'subsample': 0.6554911608578311, 'subsample_freq': 2, 'colsample_bytree': 0.864803089169032, 'max_cat_to_onehot': 7, 'drop_rate': 0.44360637128816327, 'skip_drop': 0.23610746258097465}. Best is trial 0 with value: 0.8821785985050076.
[I 2026-05-08 14:12:48,732] Trial 6 finished with value: 0.8674281758647459 and parameters: {'n_estimators': 103, 'boosting_type': 'dart', 'num_leaves': 121, 'max_depth': 10, 'min_child_samples': 52, 'min_child_weight': 0.0036999724314638123, 'learning_rate': 0.007162786999897343, 'reg_alpha': 1.6934490731313353e-08, 'reg_lambda': 9.354548757337708e-08, 'subsample': 0.5157145928433671, 'subsample_freq': 5, 'colsample_bytree': 0.6571779905381634, 'max_cat_to_onehot': 6, 'drop_rate': 0.4537832369630465, 'skip_drop': 0.12464611457443747}. Best is trial 0 with value: 0.8821785985050076.
[I 2026-05-08 14:12:49,925] Trial 7 finished with value: 0.8867154362435079 and parameters: {'n_estimators': 235, 'boosting_type': 'gbdt', 'num_leaves': 33, 'max_depth': 5, 'min_child_samples': 20, 'min_child_weight': 0.06153085601625314, 'learning_rate': 0.04132765459466366, 'reg_alpha': 0.005019191993687105, 'reg_lambda': 0.6968596391373533, 'subsample': 0.9018360384495572, 'subsample_freq': 1, 'colsample_bytree': 0.9462794992449889, 'max_cat_to_onehot': 6}. Best is trial 7 with value: 0.8867154362435079.
[I 2026-05-08 14:12:50,523] Trial 8 finished with value: 0.8855456156628765 and parameters: {'n_estimators': 414, 'boosting_type': 'gbdt', 'num_leaves': 39, 'max_depth': 5, 'min_child_samples': 46, 'min_child_weight': 0.028447512555118206, 'learning_rate': 0.05265761277157429, 'reg_alpha': 1.1549659339590204e-08, 'reg_lambda': 0.00039511700681839584, 'subsample': 0.7087055015743895, 'subsample_freq': 1, 'colsample_bytree': 0.5599326836668415, 'max_cat_to_onehot': 5}. Best is trial 7 with value: 0.8867154362435079.
[I 2026-05-08 14:12:53,602] Trial 9 finished with value: 0.8593569621746713 and parameters: {'n_estimators': 475, 'boosting_type': 'dart', 'num_leaves': 147, 'max_depth': 6, 'min_child_samples': 98, 'min_child_weight': 0.07715105777813053, 'learning_rate': 0.0031883397351001883, 'reg_alpha': 0.00029870091504560114, 'reg_lambda': 5.103930927389519e-06, 'subsample': 0.6424202471887338, 'subsample_freq': 0, 'colsample_bytree': 0.8047821669899484, 'max_cat_to_onehot': 6, 'drop_rate': 0.025739375624994676, 'skip_drop': 0.13932323211830572}. Best is trial 7 with value: 0.8867154362435079.
[I 2026-05-08 14:12:54,171] Trial 10 finished with value: 0.8936252757981137 and parameters: {'n_estimators': 255, 'boosting_type': 'gbdt', 'num_leaves': 75, 'max_depth': 3, 'min_child_samples': 6, 'min_child_weight': 0.012003107120326536, 'learning_rate': 0.08677313284480309, 'reg_alpha': 0.6849678843923125, 'reg_lambda': 5.3155934691365925, 'subsample': 0.963511379591144, 'subsample_freq': 4, 'colsample_bytree': 0.9729048599868564, 'max_cat_to_onehot': 9}. Best is trial 10 with value: 0.8936252757981137.
[I 2026-05-08 14:12:54,789] Trial 11 finished with value: 0.893559199706881 and parameters: {'n_estimators': 257, 'boosting_type': 'gbdt', 'num_leaves': 66, 'max_depth': 3, 'min_child_samples': 5, 'min_child_weight': 0.013470383332883607, 'learning_rate': 0.08727256253516028, 'reg_alpha': 1.551463762611295, 'reg_lambda': 9.738753375713546, 'subsample': 0.9762274063554256, 'subsample_freq': 4, 'colsample_bytree': 0.9950390122312885, 'max_cat_to_onehot': 9}. Best is trial 10 with value: 0.8936252757981137.
[I 2026-05-08 14:12:55,282] Trial 12 finished with value: 0.8888393101450429 and parameters: {'n_estimators': 290, 'boosting_type': 'gbdt', 'num_leaves': 76, 'max_depth': 3, 'min_child_samples': 5, 'min_child_weight': 0.012033682924178933, 'learning_rate': 0.08049530321888945, 'reg_alpha': 9.276781034740006, 'reg_lambda': 9.501608355367622, 'subsample': 0.9993939439753342, 'subsample_freq': 4, 'colsample_bytree': 0.9826689730327275, 'max_cat_to_onehot': 10}. Best is trial 10 with value: 0.8936252757981137.
[I 2026-05-08 14:12:55,622] Trial 13 finished with value: 0.8886164855922167 and parameters: {'n_estimators': 212, 'boosting_type': 'gbdt', 'num_leaves': 72, 'max_depth': 3, 'min_child_samples': 71, 'min_child_weight': 0.01486580248198092, 'learning_rate': 0.09382316945272248, 'reg_alpha': 0.17346540965254123, 'reg_lambda': 0.009788936902521384, 'subsample': 0.9741694483324969, 'subsample_freq': 4, 'colsample_bytree': 0.7668254617284119, 'max_cat_to_onehot': 8}. Best is trial 10 with value: 0.8936252757981137.
[I 2026-05-08 14:12:56,526] Trial 14 finished with value: 0.8885118303208518 and parameters: {'n_estimators': 302, 'boosting_type': 'gbdt', 'num_leaves': 80, 'max_depth': 3, 'min_child_samples': 5, 'min_child_weight': 0.0017666483428865746, 'learning_rate': 0.023229744756547575, 'reg_alpha': 0.2879406477247182, 'reg_lambda': 9.060016112931956, 'subsample': 0.8704704693369303, 'subsample_freq': 5, 'colsample_bytree': 0.9949139460522732, 'max_cat_to_onehot': 9}. Best is trial 10 with value: 0.8936252757981137.
[I 2026-05-08 14:12:57,891] Trial 15 finished with value: 0.8827219455955934 and parameters: {'n_estimators': 365, 'boosting_type': 'gbdt', 'num_leaves': 92, 'max_depth': 9, 'min_child_samples': 65, 'min_child_weight': 0.0052610012201075255, 'learning_rate': 0.007353908634994806, 'reg_alpha': 0.15311977147355438, 'reg_lambda': 0.006216326117923342, 'subsample': 0.9046560064252495, 'subsample_freq': 3, 'colsample_bytree': 0.7038579750380444, 'max_cat_to_onehot': 8}. Best is trial 10 with value: 0.8936252757981137.
[I 2026-05-08 14:12:58,428] Trial 16 finished with value: 0.8879220561585196 and parameters: {'n_estimators': 248, 'boosting_type': 'gbdt', 'num_leaves': 53, 'max_depth': 4, 'min_child_samples': 28, 'min_child_weight': 0.016425640589018943, 'learning_rate': 0.09674510068582529, 'reg_alpha': 0.8957649481037245, 'reg_lambda': 0.10464785281134634, 'subsample': 0.8163151963811591, 'subsample_freq': 5, 'colsample_bytree': 0.836539857186027, 'max_cat_to_onehot': 9}. Best is trial 10 with value: 0.8936252757981137.
[I 2026-05-08 14:12:59,537] Trial 17 finished with value: 0.8825024898346049 and parameters: {'n_estimators': 185, 'boosting_type': 'gbdt', 'num_leaves': 151, 'max_depth': 5, 'min_child_samples': 11, 'min_child_weight': 0.0018072247771756882, 'learning_rate': 0.024658846838804614, 'reg_alpha': 0.028214456422822047, 'reg_lambda': 0.6624826635963764, 'subsample': 0.9395402586397114, 'subsample_freq': 2, 'colsample_bytree': 0.9370758204210594, 'max_cat_to_onehot': 8}. Best is trial 10 with value: 0.8936252757981137.
[I 2026-05-08 14:13:00,663] Trial 18 finished with value: 0.8717882414139501 and parameters: {'n_estimators': 267, 'boosting_type': 'gbdt', 'num_leaves': 95, 'max_depth': 7, 'min_child_samples': 36, 'min_child_weight': 0.009292255597962401, 'learning_rate': 0.004825034947064838, 'reg_alpha': 0.00030591417571228507, 'reg_lambda': 0.0012715442253635719, 'subsample': 0.8482687424727493, 'subsample_freq': 4, 'colsample_bytree': 0.9987349142404867, 'max_cat_to_onehot': 9}. Best is trial 10 with value: 0.8936252757981137.
[I 2026-05-08 14:13:01,692] Trial 19 finished with value: 0.8831477369446462 and parameters: {'n_estimators': 353, 'boosting_type': 'gbdt', 'num_leaves': 55, 'max_depth': 4, 'min_child_samples': 61, 'min_child_weight': 0.023912326690320927, 'learning_rate': 0.013119568106633147, 'reg_alpha': 4.130867764433515, 'reg_lambda': 1.5544977737472501e-06, 'subsample': 0.956423012615349, 'subsample_freq': 6, 'colsample_bytree': 0.794931688410759, 'max_cat_to_onehot': 10}. Best is trial 10 with value: 0.8936252757981137.
[I 2026-05-08 14:13:02,046] Trial 20 finished with value: 0.8737914114352263 and parameters: {'n_estimators': 426, 'boosting_type': 'gbdt', 'num_leaves': 51, 'max_depth': 6, 'min_child_samples': 46, 'min_child_weight': 0.00014738832327554048, 'learning_rate': 0.0010433696140601197, 'reg_alpha': 2.427220124791874e-05, 'reg_lambda': 1.862584685726714, 'subsample': 0.7784153508562188, 'subsample_freq': 3, 'colsample_bytree': 0.7012000322254772, 'max_cat_to_onehot': 4}. Best is trial 10 with value: 0.8936252757981137.
[I 2026-05-08 14:13:02,632] Trial 21 finished with value: 0.891649530923894 and parameters: {'n_estimators': 291, 'boosting_type': 'gbdt', 'num_leaves': 20, 'max_depth': 3, 'min_child_samples': 5, 'min_child_weight': 0.010332886847537854, 'learning_rate': 0.07521455522556138, 'reg_alpha': 7.006012019793071, 'reg_lambda': 6.1442860179517504, 'subsample': 0.9832934053258588, 'subsample_freq': 4, 'colsample_bytree': 0.9551530177460259, 'max_cat_to_onehot': 10}. Best is trial 10 with value: 0.8936252757981137.
[I 2026-05-08 14:13:03,358] Trial 22 finished with value: 0.8928134560335211 and parameters: {'n_estimators': 322, 'boosting_type': 'gbdt', 'num_leaves': 95, 'max_depth': 3, 'min_child_samples': 10, 'min_child_weight': 0.0030240515314100777, 'learning_rate': 0.05612739528303173, 'reg_alpha': 1.1368014419008121, 'reg_lambda': 9.59553631248135, 'subsample': 0.9192824485713966, 'subsample_freq': 4, 'colsample_bytree': 0.9506016357309363, 'max_cat_to_onehot': 9}. Best is trial 10 with value: 0.8936252757981137.
[I 2026-05-08 14:13:04,093] Trial 23 finished with value: 0.8901419512275476 and parameters: {'n_estimators': 326, 'boosting_type': 'gbdt', 'num_leaves': 96, 'max_depth': 4, 'min_child_samples': 27, 'min_child_weight': 0.002551918025101667, 'learning_rate': 0.0559864689350777, 'reg_alpha': 0.8111777420583727, 'reg_lambda': 0.09138226719985944, 'subsample': 0.9199192280908066, 'subsample_freq': 5, 'colsample_bytree': 0.8993024886288766, 'max_cat_to_onehot': 7}. Best is trial 10 with value: 0.8936252757981137.
[I 2026-05-08 14:13:04,606] Trial 24 finished with value: 0.8879245490635048 and parameters: {'n_estimators': 162, 'boosting_type': 'gbdt', 'num_leaves': 89, 'max_depth': 3, 'min_child_samples': 13, 'min_child_weight': 0.0008646844369009962, 'learning_rate': 0.02997814507833473, 'reg_alpha': 0.05107293244598512, 'reg_lambda': 0.3041759362823091, 'subsample': 0.876883342129067, 'subsample_freq': 2, 'colsample_bytree': 0.846505381169205, 'max_cat_to_onehot': 9}. Best is trial 10 with value: 0.8936252757981137.
[I 2026-05-08 14:13:05,644] Trial 25 finished with value: 0.8902490121173772 and parameters: {'n_estimators': 258, 'boosting_type': 'gbdt', 'num_leaves': 60, 'max_depth': 5, 'min_child_samples': 12, 'min_child_weight': 0.005413965227221064, 'learning_rate': 0.06361831155482692, 'reg_alpha': 0.912654020716209, 'reg_lambda': 3.3693154832007255, 'subsample': 0.9428591260144574, 'subsample_freq': 6, 'colsample_bytree': 0.9612478300658595, 'max_cat_to_onehot': 8}. Best is trial 10 with value: 0.8936252757981137.
[I 2026-05-08 14:13:08,921] Trial 26 finished with value: 0.8765842111208972 and parameters: {'n_estimators': 390, 'boosting_type': 'dart', 'num_leaves': 105, 'max_depth': 4, 'min_child_samples': 23, 'min_child_weight': 0.0004734011356444794, 'learning_rate': 0.04222412516105002, 'reg_alpha': 0.0012772796443230473, 'reg_lambda': 0.043735583159630116, 'subsample': 0.9966193431932524, 'subsample_freq': 3, 'colsample_bytree': 0.9223405185405973, 'max_cat_to_onehot': 7, 'drop_rate': 0.1866295836032223, 'skip_drop': 0.4902821451257978}. Best is trial 10 with value: 0.8936252757981137.
[I 2026-05-08 14:13:09,852] Trial 27 finished with value: 0.8896715421378969 and parameters: {'n_estimators': 324, 'boosting_type': 'gbdt', 'num_leaves': 194, 'max_depth': 3, 'min_child_samples': 13, 'min_child_weight': 0.03881919922277937, 'learning_rate': 0.0193062196586317, 'reg_alpha': 0.056416137669441924, 'reg_lambda': 1.77877712141761, 'subsample': 0.8433898269325133, 'subsample_freq': 4, 'colsample_bytree': 0.8767735907977774, 'max_cat_to_onehot': 9}. Best is trial 10 with value: 0.8936252757981137.
[I 2026-05-08 14:13:10,507] Trial 28 finished with value: 0.8885709035085769 and parameters: {'n_estimators': 197, 'boosting_type': 'gbdt', 'num_leaves': 136, 'max_depth': 4, 'min_child_samples': 5, 'min_child_weight': 0.0026810108999017913, 'learning_rate': 0.09960635711827055, 'reg_alpha': 0.8309205946235553, 'reg_lambda': 0.0021956073856188164, 'subsample': 0.9308316632570155, 'subsample_freq': 5, 'colsample_bytree': 0.9688600362959965, 'max_cat_to_onehot': 2}. Best is trial 10 with value: 0.8936252757981137.
