[I 2026-05-08 14:13:40,722] Trial 0 finished with value: -0.6712629686348733 and parameters: {'n_estimators': 218, 'boosting_type': 'gbdt', 'num_leaves': 128, 'max_depth': 4, 'min_child_samples': 19, 'min_child_weight': 0.00014936568554617635, 'learning_rate': 0.05399484409787434, 'reg_alpha': 0.002570603566117598, 'reg_lambda': 0.023585940584142682, 'subsample': 0.5102922471479012, 'subsample_freq': 7, 'colsample_bytree': 0.9162213204002109, 'max_cat_to_onehot': 3}. Best is trial 0 with value: -0.6712629686348733.
[I 2026-05-08 14:13:47,494] Trial 1 finished with value: -0.9500981868870191 and parameters: {'n_estimators': 132, 'boosting_type': 'dart', 'num_leaves': 114, 'max_depth': 7, 'min_child_samples': 32, 'min_child_weight': 0.006847920095574782, 'learning_rate': 0.0019010245319870357, 'reg_alpha': 4.258943089524393e-06, 'reg_lambda': 1.9826980964985924e-05, 'subsample': 0.728034992108518, 'subsample_freq': 6, 'colsample_bytree': 0.5998368910791798, 'max_cat_to_onehot': 6, 'drop_rate': 0.29620728443102123, 'skip_drop': 0.023225206359998862}. Best is trial 1 with value: -0.9500981868870191.
[I 2026-05-08 14:13:55,016] Trial 2 finished with value: -0.835655732436287 and parameters: {'n_estimators': 324, 'boosting_type': 'gbdt', 'num_leaves': 191, 'max_depth': 12, 'min_child_samples': 82, 'min_child_weight': 0.0008200518402245837, 'learning_rate': 0.0015679933916723015, 'reg_alpha': 0.014391207615728067, 'reg_lambda': 9.148975058772307e-05, 'subsample': 0.5610191174223894, 'subsample_freq': 3, 'colsample_bytree': 0.5171942605576092, 'max_cat_to_onehot': 10}. Best is trial 1 with value: -0.9500981868870191.
[I 2026-05-08 14:13:59,001] Trial 3 finished with value: -0.6602367583816043 and parameters: {'n_estimators': 166, 'boosting_type': 'gbdt', 'num_leaves': 114, 'max_depth': 8, 'min_child_samples': 22, 'min_child_weight': 0.08105016126411585, 'learning_rate': 0.035503048581283086, 'reg_alpha': 2.854239907497756, 'reg_lambda': 1.1309571585271483, 'subsample': 0.7989499894055425, 'subsample_freq': 7, 'colsample_bytree': 0.5442462510259598, 'max_cat_to_onehot': 3}. Best is trial 1 with value: -0.9500981868870191.
[I 2026-05-08 14:14:01,094] Trial 4 finished with value: -0.7815872794069858 and parameters: {'n_estimators': 70, 'boosting_type': 'dart', 'num_leaves': 69, 'max_depth': 11, 'min_child_samples': 39, 'min_child_weight': 0.0006963114377829289, 'learning_rate': 0.012172847081122434, 'reg_alpha': 1.8548894229694903e-07, 'reg_lambda': 0.16587190283399655, 'subsample': 0.5372753218398854, 'subsample_freq': 7, 'colsample_bytree': 0.8861223846483287, 'max_cat_to_onehot': 3, 'drop_rate': 0.0027610585618011996, 'skip_drop': 0.4077307142274171}. Best is trial 1 with value: -0.9500981868870191.
[I 2026-05-08 14:14:19,385] Trial 5 finished with value: -0.8330637931791097 and parameters: {'n_estimators': 368, 'boosting_type': 'dart', 'num_leaves': 33, 'max_depth': 6, 'min_child_samples': 16, 'min_child_weight': 0.038842777547031436, 'learning_rate': 0.01764396768338155, 'reg_alpha': 9.507847858536042e-06, 'reg_lambda': 3.732717755563729e-08, 'subsample': 0.6554911608578311, 'subsample_freq': 2, 'colsample_bytree': 0.864803089169032, 'max_cat_to_onehot': 7, 'drop_rate': 0.44360637128816327, 'skip_drop': 0.23610746258097465}. Best is trial 1 with value: -0.9500981868870191.
[I 2026-05-08 14:14:25,443] Trial 6 finished with value: -0.9314611419090115 and parameters: {'n_estimators': 103, 'boosting_type': 'dart', 'num_leaves': 121, 'max_depth': 10, 'min_child_samples': 52, 'min_child_weight': 0.0036999724314638123, 'learning_rate': 0.007162786999897343, 'reg_alpha': 1.6934490731313353e-08, 'reg_lambda': 9.354548757337708e-08, 'subsample': 0.5157145928433671, 'subsample_freq': 5, 'colsample_bytree': 0.6571779905381634, 'max_cat_to_onehot': 6, 'drop_rate': 0.4537832369630465, 'skip_drop': 0.12464611457443747}. Best is trial 1 with value: -0.9500981868870191.
[I 2026-05-08 14:14:28,215] Trial 7 finished with value: -0.6613291339457246 and parameters: {'n_estimators': 235, 'boosting_type': 'gbdt', 'num_leaves': 33, 'max_depth': 5, 'min_child_samples': 20, 'min_child_weight': 0.06153085601625314, 'learning_rate': 0.04132765459466366, 'reg_alpha': 0.005019191993687105, 'reg_lambda': 0.6968596391373533, 'subsample': 0.9018360384495572, 'subsample_freq': 1, 'colsample_bytree': 0.9462794992449889, 'max_cat_to_onehot': 6}. Best is trial 1 with value: -0.9500981868870191.
[I 2026-05-08 14:14:31,590] Trial 8 finished with value: -0.6494198541722928 and parameters: {'n_estimators': 414, 'boosting_type': 'gbdt', 'num_leaves': 39, 'max_depth': 5, 'min_child_samples': 46, 'min_child_weight': 0.028447512555118206, 'learning_rate': 0.05265761277157429, 'reg_alpha': 1.1549659339590204e-08, 'reg_lambda': 0.00039511700681839584, 'subsample': 0.7087055015743895, 'subsample_freq': 1, 'colsample_bytree': 0.5599326836668415, 'max_cat_to_onehot': 5}. Best is trial 1 with value: -0.9500981868870191.
[I 2026-05-08 14:14:42,170] Trial 9 finished with value: -0.8973360761896967 and parameters: {'n_estimators': 475, 'boosting_type': 'dart', 'num_leaves': 147, 'max_depth': 6, 'min_child_samples': 98, 'min_child_weight': 0.07715105777813053, 'learning_rate': 0.0031883397351001883, 'reg_alpha': 0.00029870091504560114, 'reg_lambda': 5.103930927389519e-06, 'subsample': 0.6424202471887338, 'subsample_freq': 0, 'colsample_bytree': 0.8047821669899484, 'max_cat_to_onehot': 6, 'drop_rate': 0.025739375624994676, 'skip_drop': 0.13932323211830572}. Best is trial 1 with value: -0.9500981868870191.
[I 2026-05-08 14:14:49,985] Trial 10 finished with value: -0.9518618782913333 and parameters: {'n_estimators': 143, 'boosting_type': 'dart', 'num_leaves': 78, 'max_depth': 8, 'min_child_samples': 73, 'min_child_weight': 0.005597940952157928, 'learning_rate': 0.001074458384715116, 'reg_alpha': 4.007100533954849e-06, 'reg_lambda': 3.6118995907992117e-06, 'subsample': 0.9961813327301683, 'subsample_freq': 5, 'colsample_bytree': 0.6780456116674969, 'max_cat_to_onehot': 9, 'drop_rate': 0.26781213201774495, 'skip_drop': 0.015446673464905341}. Best is trial 10 with value: -0.9518618782913333.
[I 2026-05-08 14:14:58,281] Trial 11 finished with value: -0.9521599966025903 and parameters: {'n_estimators': 140, 'boosting_type': 'dart', 'num_leaves': 79, 'max_depth': 8, 'min_child_samples': 73, 'min_child_weight': 0.00746641201585721, 'learning_rate': 0.0010327788094764748, 'reg_alpha': 3.459150005782469e-06, 'reg_lambda': 2.9536889586486034e-06, 'subsample': 0.9920773352883635, 'subsample_freq': 5, 'colsample_bytree': 0.6860854659284155, 'max_cat_to_onehot': 9, 'drop_rate': 0.25711146158659437, 'skip_drop': 0.0014759474439721178}. Best is trial 11 with value: -0.9521599966025903.
[I 2026-05-08 14:15:00,646] Trial 12 finished with value: -0.9514802225771393 and parameters: {'n_estimators': 51, 'boosting_type': 'dart', 'num_leaves': 76, 'max_depth': 9, 'min_child_samples': 71, 'min_child_weight': 0.011389740369231405, 'learning_rate': 0.0010623818229569288, 'reg_alpha': 5.38290491006254e-06, 'reg_lambda': 7.0822148866574e-07, 'subsample': 0.9980084946806067, 'subsample_freq': 4, 'colsample_bytree': 0.6857823444904408, 'max_cat_to_onehot': 10, 'drop_rate': 0.20855513115307206, 'skip_drop': 0.022549429991350112}. Best is trial 11 with value: -0.9521599966025903.
[I 2026-05-08 14:15:13,139] Trial 13 finished with value: -0.9475915796919064 and parameters: {'n_estimators': 172, 'boosting_type': 'dart', 'num_leaves': 81, 'max_depth': 8, 'min_child_samples': 66, 'min_child_weight': 0.0016053896115105297, 'learning_rate': 0.00395412287948764, 'reg_alpha': 8.400645526659066e-05, 'reg_lambda': 0.0017482274705964069, 'subsample': 0.9945509672278392, 'subsample_freq': 5, 'colsample_bytree': 0.7423578866620044, 'max_cat_to_onehot': 8, 'drop_rate': 0.24082818508135387, 'skip_drop': 0.005696482803719996}. Best is trial 11 with value: -0.9521599966025903.
                                                                               
                          

Best trial: 11. Best value: -0.95216:  90%|笆遺毎笆遺毎笆遺毎笆遺毎笆・| 27/30 [03:16<00:14, 
 4.98s/it, 187.81/300 seconds]
Best trial: 11. Best value: -0.95216:  90%|笆遺毎笆遺毎笆遺毎笆遺毎笆・| 27/30 [03:16<00:14, 
 4.98s/it, 187.81/300 seconds]
Best trial: 11. Best value: -0.95216:  93%|笆遺毎笆遺毎笆遺毎笆遺毎笆遺鮪| 28/30 [03:16<00:12,
  6.19s/it, 187.81/300 seconds]
Best trial: 11. Best value: -0.95216:  93%|笆遺毎笆遺毎笆遺毎笆遺毎笆遺鮪| 28/30 [03:16<00:12,
  6.19s/it, 196.84/300 seconds]
                                                                               
                          

Best trial: 11. Best value: -0.95216:  93%|笆遺毎笆遺毎笆遺毎笆遺毎笆遺鮪| 28/30 [03:21<00:12,
  6.19s/it, 196.84/300 seconds]
Best trial: 11. Best value: -0.95216:  93%|笆遺毎笆遺毎笆遺毎笆遺毎笆遺鮪| 28/30 [03:21<00:12,
  6.19s/it, 196.84/300 seconds]
Best trial: 11. Best value: -0.95216:  97%|笆遺毎笆遺毎笆遺毎笆遺毎笆遺幕| 29/30 [03:21<00:05,
  5.69s/it, 196.84/300 seconds]
Best trial: 11. Best value: -0.95216:  97%|笆遺毎笆遺毎笆遺毎笆遺毎笆遺幕| 29/30 [03:21<00:05,
  5.69s/it, 201.35/300 seconds]
                                                                               
                          

Best trial: 11. Best value: -0.95216:  97%|笆遺毎笆遺毎笆遺毎笆遺毎笆遺幕| 29/30 [03:26<00:05,
  5.69s/it, 201.35/300 seconds]
Best trial: 11. Best value: -0.95216:  97%|笆遺毎笆遺毎笆遺毎笆遺毎笆遺幕| 29/30 [03:26<00:05,
  5.69s/it, 201.35/300 seconds]
Best trial: 11. Best value: -0.95216: 100%|笆遺毎笆遺毎笆遺毎笆遺毎笆遺毎| 30/30 [03:26<00:00,
  5.46s/it, 201.35/300 seconds]
Best trial: 11. Best value: -0.95216: 100%|笆遺毎笆遺毎笆遺毎笆遺毎笆遺毎| 30/30 [03:26<00:00,
  5.46s/it, 206.28/300 seconds]
Best trial: 11. Best value: -0.95216: 100%|笆遺毎笆遺毎笆遺毎笆遺毎笆遺毎| 30/30 [03:26<00:00,
  6.88s/it, 206.28/300 seconds]
[I 2026-05-08 14:15:32,576] Trial 14 finished with value: -0.9418538195922436 and parameters: {'n_estimators': 280, 'boosting_type': 'dart', 'num_leaves': 61, 'max_depth': 9, 'min_child_samples': 88, 'min_child_weight': 0.012900049681439811, 'learning_rate': 0.0031430759773507884, 'reg_alpha': 2.8084375814417464e-07, 'reg_lambda': 1.5028771303358993e-06, 'subsample': 0.8892207973866099, 'subsample_freq': 4, 'colsample_bytree': 0.7409145437615329, 'max_cat_to_onehot': 9, 'drop_rate': 0.3338962247920463, 'skip_drop': 0.14104680214121137}. Best is trial 11 with value: -0.9521599966025903.
[I 2026-05-08 14:15:35,288] Trial 15 finished with value: -0.9381701034852071 and parameters: {'n_estimators': 210, 'boosting_type': 'dart', 'num_leaves': 92, 'max_depth': 3, 'min_child_samples': 63, 'min_child_weight': 0.0028033523130231884, 'learning_rate': 0.001009456736582037, 'reg_alpha': 6.341756081168334e-07, 'reg_lambda': 3.218721948185565e-07, 'subsample': 0.9013304738750414, 'subsample_freq': 5, 'colsample_bytree': 0.6478194429478883, 'max_cat_to_onehot': 8, 'drop_rate': 0.12446135114828671, 'skip_drop': 0.43411350212318545}. Best is trial 11 with value: -0.9521599966025903.
[I 2026-05-08 14:15:42,581] Trial 16 finished with value: -0.9243299398794044 and parameters: {'n_estimators': 108, 'boosting_type': 'dart', 'num_leaves': 163, 'max_depth': 10, 'min_child_samples': 78, 'min_child_weight': 0.017777774360775045, 'learning_rate': 0.005606312703026591, 'reg_alpha': 2.427688681472577e-05, 'reg_lambda': 1.5470159726213673e-05, 'subsample': 0.8239910716566201, 'subsample_freq': 3, 'colsample_bytree': 0.799035456308464, 'max_cat_to_onehot': 9, 'drop_rate': 0.35177323950391004, 'skip_drop': 0.27186905924745514}. Best is trial 11 with value: -0.9521599966025903.
[I 2026-05-08 14:15:55,717] Trial 17 finished with value: -0.7895119070037218 and parameters: {'n_estimators': 277, 'boosting_type': 'dart', 'num_leaves': 53, 'max_depth': 7, 'min_child_samples': 60, 'min_child_weight': 0.005352000546550735, 'learning_rate': 0.09526261766589332, 'reg_alpha': 0.09877320514031875, 'reg_lambda': 0.001042799396314031, 'subsample': 0.9423153942123118, 'subsample_freq': 6, 'colsample_bytree': 0.6829880524457749, 'max_cat_to_onehot': 8, 'drop_rate': 0.14310018877746944, 'skip_drop': 0.07318278143794017}. Best is trial 11 with value: -0.9521599966025903.
[I 2026-05-08 14:16:04,246] Trial 18 finished with value: -0.9453794400514361 and parameters: {'n_estimators': 171, 'boosting_type': 'dart', 'num_leaves': 97, 'max_depth': 9, 'min_child_samples': 96, 'min_child_weight': 0.0015641665025133008, 'learning_rate': 0.0019075296459409208, 'reg_alpha': 7.431553278172201e-07, 'reg_lambda': 1.570569569095289e-08, 'subsample': 0.82812808100111, 'subsample_freq': 6, 'colsample_bytree': 0.6006931178161777, 'max_cat_to_onehot': 9, 'drop_rate': 0.1788424470241321, 'skip_drop': 0.23147471347314283}. Best is trial 11 with value: -0.9521599966025903.
[I 2026-05-08 14:16:10,919] Trial 19 finished with value: -0.9493869315902824 and parameters: {'n_estimators': 137, 'boosting_type': 'dart', 'num_leaves': 93, 'max_depth': 6, 'min_child_samples': 73, 'min_child_weight': 0.0001888255536685783, 'learning_rate': 0.0024048001870587347, 'reg_alpha': 0.00031475947544244227, 'reg_lambda': 0.00846833065510113, 'subsample': 0.9469735598502689, 'subsample_freq': 4, 'colsample_bytree': 0.7817912640660164, 'max_cat_to_onehot': 10, 'drop_rate': 0.3833879093355542, 'skip_drop': 0.08218995311758774}. Best is trial 11 with value: -0.9521599966025903.
[I 2026-05-08 14:16:23,081] Trial 20 finished with value: -0.9378382430908623 and parameters: {'n_estimators': 230, 'boosting_type': 'dart', 'num_leaves': 51, 'max_depth': 12, 'min_child_samples': 57, 'min_child_weight': 0.0003052656982045628, 'learning_rate': 0.0013889640002600577, 'reg_alpha': 7.277031993654024e-08, 'reg_lambda': 8.469419985812441e-05, 'subsample': 0.8623259413801991, 'subsample_freq': 5, 'colsample_bytree': 0.7263920874203913, 'max_cat_to_onehot': 4, 'drop_rate': 0.26407973502051135, 'skip_drop': 0.3327302158449386}. Best is trial 11 with value: -0.9521599966025903.
[I 2026-05-08 14:16:25,627] Trial 21 finished with value: -0.9518910288777492 and parameters: {'n_estimators': 53, 'boosting_type': 'dart', 'num_leaves': 77, 'max_depth': 10, 'min_child_samples': 72, 'min_child_weight': 0.009619168691629635, 'learning_rate': 0.001013069307678924, 'reg_alpha': 6.507678068464388e-06, 'reg_lambda': 8.553150531149951e-07, 'subsample': 0.9968384542650621, 'subsample_freq': 4, 'colsample_bytree': 0.6823069662903822, 'max_cat_to_onehot': 10, 'drop_rate': 0.20651389588462443, 'skip_drop': 0.002587148192473249}. Best is trial 11 with value: -0.9521599966025903.
[I 2026-05-08 14:16:29,151] Trial 22 finished with value: -0.9488907683649896 and parameters: {'n_estimators': 87, 'boosting_type': 'dart', 'num_leaves': 82, 'max_depth': 10, 'min_child_samples': 86, 'min_child_weight': 0.007772190094214766, 'learning_rate': 0.0010139190702257118, 'reg_alpha': 1.8226952759203013e-06, 'reg_lambda': 3.2695652124939795e-06, 'subsample': 0.9627283694828701, 'subsample_freq': 3, 'colsample_bytree': 0.6406860255721522, 'max_cat_to_onehot': 9, 'drop_rate': 0.08621485761571043, 'skip_drop': 0.07472106341915594}. Best is trial 11 with value: -0.9521599966025903.
[I 2026-05-08 14:16:30,653] Trial 23 finished with value: -0.9508702253607237 and parameters: {'n_estimators': 52, 'boosting_type': 'dart', 'num_leaves': 21, 'max_depth': 8, 'min_child_samples': 72, 'min_child_weight': 0.02434534586736237, 'learning_rate': 0.0023029007249182934, 'reg_alpha': 3.473735561547297e-05, 'reg_lambda': 1.906136791564062e-07, 'subsample': 0.9457706357127303, 'subsample_freq': 4, 'colsample_bytree': 0.7107462218179907, 'max_cat_to_onehot': 10, 'drop_rate': 0.27807963872252517, 'skip_drop': 0.004787291339649018}. Best is trial 11 with value: -0.9521599966025903.
[I 2026-05-08 14:16:38,480] Trial 24 finished with value: -0.9464118814961153 and parameters: {'n_estimators': 137, 'boosting_type': 'dart', 'num_leaves': 96, 'max_depth': 11, 'min_child_samples': 91, 'min_child_weight': 0.00292220248543586, 'learning_rate': 0.0013931853414648652, 'reg_alpha': 9.462467724807456e-05, 'reg_lambda': 2.3503713995319257e-05, 'subsample': 0.9914293511598634, 'subsample_freq': 6, 'colsample_bytree': 0.9959782326816241, 'max_cat_to_onehot': 7, 'drop_rate': 0.1968390525503755, 'skip_drop': 0.17426967480837852}. Best is trial 11 with value: -0.9521599966025903.
[I 2026-05-08 14:16:42,470] Trial 25 finished with value: -0.9225670897039144 and parameters: {'n_estimators': 105, 'boosting_type': 'dart', 'num_leaves': 65, 'max_depth': 9, 'min_child_samples': 5, 'min_child_weight': 0.009909372577499671, 'learning_rate': 0.0029591891672414335, 'reg_alpha': 7.37955263965148e-08, 'reg_lambda': 1.7962653536166064e-06, 'subsample': 0.7730105976085351, 'subsample_freq': 5, 'colsample_bytree': 0.6168032342647848, 'max_cat_to_onehot': 8, 'drop_rate': 0.23165373326489763, 'skip_drop': 0.49833853240406845}. Best is trial 11 with value: -0.9521599966025903.
[I 2026-05-08 14:16:46,859] Trial 26 finished with value: -0.774907917843502 and parameters: {'n_estimators': 188, 'boosting_type': 'gbdt', 'num_leaves': 138, 'max_depth': 7, 'min_child_samples': 78, 'min_child_weight': 0.0049155028829851065, 'learning_rate': 0.004704498891428481, 'reg_alpha': 1.8379490359276325e-06, 'reg_lambda': 7.82642962688875e-08, 'subsample': 0.9224900353628535, 'subsample_freq': 2, 'colsample_bytree': 0.7729824995446786, 'max_cat_to_onehot': 9}. Best is trial 11 with value: -0.9521599966025903.
[I 2026-05-08 14:16:55,888] Trial 27 finished with value: -0.9513519472287972 and parameters: {'n_estimators': 128, 'boosting_type': 'dart', 'num_leaves': 107, 'max_depth': 11, 'min_child_samples': 52, 'min_child_weight': 0.0017355050466777314, 'learning_rate': 0.0014576889452704571, 'reg_alpha': 1.4496077213297235e-05, 'reg_lambda': 9.352707453484271e-05, 'subsample': 0.8558148864652866, 'subsample_freq': 4, 'colsample_bytree': 0.8391925952258472, 'max_cat_to_onehot': 7, 'drop_rate': 0.301261396977851, 'skip_drop': 0.061041256663151744}. Best is trial 11 with value: -0.9521599966025903.
[I 2026-05-08 14:17:00,400] Trial 28 finished with value: -0.9384421069046134 and parameters: {'n_estimators': 82, 'boosting_type': 'dart', 'num_leaves': 81, 'max_depth': 8, 'min_child_samples': 68, 'min_child_weight': 0.01778498796554441, 'learning_rate': 0.010367158743165754, 'reg_alpha': 0.002299412831402098, 'reg_lambda': 1.0305050066959612e-08, 'subsample': 0.978318006337634, 'subsample_freq': 5, 'colsample_bytree': 0.6742641657805337, 'max_cat_to_onehot': 2, 'drop_rate': 0.39841801415248845, 'skip_drop': 0.05357755566603131}. Best is trial 11 with value: -0.9521599966025903.
